date,rating,comment,category
5-Jan-24,Rated 3 stars out of five stars,"I've always loved the apps, been using for years. One feature I like is the album feature. So photos of my husband and I, I put in one album, photos of my daughter I put in another. It makes it easier for me to find photos that way. In the past I use to be able to select multiple photos to transfer to particular albums. Since an update has been made that is no longer an option so it takes longer to transfer photos.",
5-Jan-24,Rated 3 stars out of five stars,"Very good and fast. Duplicate checking is incredible. But Flickr has more organizing features. 1)We have option to sort photos or videos in an Album but Please add option to sort Albums by name or any order that we can customize. 2)Please give us an option to search for photos that were never not added to an Album.3)Please add option to show the number of Photos and Videos in the Album like Flickr, right it just shows the total combined. 4)Please give us a ""Where used""option for each photo/video, so that we know which Album it is used",
5-Jan-24,Rated 5 stars out of five stars,"I love Google Photos. Apart from being able to store and access my photos from different devices, I have to say that the photo editing tools are just great. It's unbelievable some of the edits that can come out from the basic editing tools. üëåüëåReally like the additional features it's been bringing such as the highlights and the photo map. I like using the vignette feature but not being able to apply it to other margins if the focus falls on one side can be a downside.",
5-Jan-24,Rated 1 stars out of five stars,"This is app is such a mess. It's extremely and unnecessarily complicated, does not let you pick and choose where you want pictures to go and it takes them away, never to be seen again. Automatically backing up photos is nothing new and is a nice feature but this app doesn't even do that right. Only problem I've had with the Pixel 3 so far is this IS the photo app.",
5-Jan-24,Rated 5 stars out of five stars,"I was pleasantly surprised at how good this app is. You just open it and your photos will start backing up. Its REALLY smart and can organize your photos based on what/who they are. (Face recognition is great, and it can also organize things like sunsets and ""palaces"" instead of ""sky"" and ""building."" Face and object recognition is perfect) One of the nicest features to me is that itll send notifications of ""__ years ago today/this week"" & you can look back on old memories. I love it.",
5-Jan-24,Rated 5 stars out of five stars,"This app is amazing! It not only stores all my photos, but also, automatically organizes them by date. It allows you to organize them in albums. The search feature is unbelievable. You can search by person, place, city, day, month, year, or by specific words like party, ballet, swimming, beach, trees, document, screenshot, videos. It also makes movies, edits photos, combines photos of the same person a long time ago and now, and you have the option to keep or dicard them. I absolutely love it!",
5-Jan-24,Rated 4 stars out of five stars,"I love the app and almost everything from Google. Two things that would make it better are more photo editing tools with a huge variety of options like a lot of the other photo editor apps. Also, the ability to lock certain albums with a passcode and a generic cover photo, just in case someone gets access to your phone or tablet etc and there is certain pictures youd rather them not see. Add those two things please!",
5-Jan-24,Rated 5 stars out of five stars,"If you don't have Google Photos, I truly feel bad for you. But that's okay, 'cause you can easily change that by tapping that 'install' button!!! This app is ESSENTIAL for high-quality photo storing, sharing, and organizing. Without Google Photos, I probably would have stored less than half of the good memories I've taken in pictures and video. Not to mention, it's free (for at least a couple years, and then it's pretty inexpensive after that)",
5-Jan-24,Rated 5 stars out of five stars,"I love this app. My phone doesn't have a regular photo gallery, so I didn't have much of a choice, but I pleasantly surprised. I do, however wish they had more editing options for my photos & videos. The unlimited storage is wonderful & allows me take all the photos & videos I like, without fear of running out of space to keep them. The assistant is a nice feature that most other apps lack & it's pretty helpful too. Plus, it allows me to easily share pics & videos with my family friends.",
5-Jan-24,Rated 3 stars out of five stars,"it is undoubtedly a great opportunity to store all your pics. In addition, the suggested GIFs are cute and many times successful. However, it is quite irritating that one cannot access the pics from various apps (such as diaries or instant messenger). It is too clumsy and annoying. What is more, in the mobile version the layout is not quite readable (not listed the date itself unlike in the desktop version)",
5-Jan-24,Rated 5 stars out of five stars,"There are many reasons to love Google Photos, and few reasons not to. I particularly love being able to search my photos with keywords and having all of the photos of the important people and pets in my life automatically sorted. I would like to see them add some editing options (like the colorize feature that they announced a while ago) but I'd still highly recommend the app in its current state.",
5-Jan-24,Rated 2 stars out of five stars,This is the only photo program available on the Google phone. It can be difficult to find photos. Sometimes they end up in the cloud and not available on the device. Sometimes they are on the device. There seems to be no rhyme or reason to which location takes priority and features to move/download photos are not always present. Google falls short with this. I miss the ease of use of iPhone's photo app.,
5-Jan-24,Rated 4 stars out of five stars,"This is indeed the best and most reliable photo app. Things that need to be added in the app:- 1. Feature to rotate photos with two fingers rotation gesture. It will be very convinient. 2. Whenever I select some photos then click send but I had to click delete (or any other options), then if I go back all photos are deselected so I had to do it all over again. 3. Photos can't be zoomed enough. I use my phone for education purposes mostly, whatsapp photos can't be zoomed to touch the inside edges.",
5-Jan-24,Rated 4 stars out of five stars,"Nice app to have photos with you all the time and even like the stylised photos that come through. Would like to be able to correct or reduce the eye reflection from the flash as sometimes the animals look a little weird. Would love to do some basic smart edits on the movies. For example, change sections of the clip from portrait to landscape view to make easier to view on device.",
5-Jan-24,Rated 1 stars out of five stars,"I absolutely hate this app! I can't view some photos because I'm off line, I can't combine albums, it's always asking me to delete old photos, blurry photos, duplicates and screenshots. I didn't realize it had an auto delete which I had to go turn off! Who knows what pictures were deleted automatically. When I tried to move pictures to another album it would just copy it rather than moving the picture! So then I get a pop up asking if I want to buy storage. My cell doesn't have its own gallery!",
5-Jan-24,Rated 5 stars out of five stars,I consider myself a basic user of the tool. I take photos and I don't really care how organized they are or even how good they came out. Google Photos seems to fullfil these two hurdles of having hundreds or even thousands of pictures in your life. I also like the movies it makes for you and I love the the lighting and stylizing feature.,
5-Jan-24,Rated 4 stars out of five stars,"Hello Google :) I love The photos app, it's the best place to store all my picture and video. My request is in reference to this app, Google photos lacks behind by one feature that is Video editing, it's something that I wish Google works on, having an option to add filters, stickers, effect, crop and also to trim the videos would be an amazing things. I hope to update the app with these features. Thank you :)",
5-Jan-24,Rated 5 stars out of five stars,"I love all Google products but this one is definitely a favorite of mine. 2 great features about this app: - Sorting by face, it's incredibly accurate. - Search photos by describing whats in the picture. For instance, you can search ""red dress"" and all pictures that contain a red dress will be shown. The bad: I wish you could merge or delete duplicate photos but that is my only complaint. Bottom Line: I've been using this app for years and it's become so amazing, I highly recommend!",
5-Jan-24,Rated 5 stars out of five stars,"I love all google programs and apps. Absolutely essential, and your not even aware until something happens, and you be lose them: ""(two step verification, after two phones are stolen and you do not have access), can not verify even if new tablet is put on same account, and know all passwords and safety questions?""... So, always have back-up phone and e-mail!!!",
5-Jan-24,Rated 2 stars out of five stars,"Thank you Google! It's reassuring to know that all my photos are automatically backed up, handy for when my phone has died and photos become inaccessible. Edit -These days I often find that the photos don't always load straight away. And sometimes the library section is blank, no folders appear. I have cleared the cache and uninstall the app multiple times and they will sometimes show but it appears to be random. Furthermore screenshots are now saved automatically from android without choice.",
5-Jan-24,Rated 3 stars out of five stars,"I expect more from Google, but it's okay I guess. This app is good, but lacks features. The huge feature that's missing is the ability to hide/lock photos/albums. You can archive, but that only hides from the main album, it will still show up in other places and thumbnails. When in an album, you can't pinch to zoom in/out like you can in the main section, which makes it hard to find pictures. It's great how cloud storage works and how easy it is to access my photos from any device though.",
5-Jan-24,Rated 5 stars out of five stars,"I no longer lose important, sentimental, and/or priceless photos and videos since I've downloaded Google photos to all of my devices. And the free up space option in the menu backs up and clears space from my devices at the same time. It suggests and makes collages w like photos and videos, even groups photos by key words or faces...It's amazing and I've recommended it to all of My Fam and Friends and they all use it now as well üòäüòç. Thanks Google Photos!!!!!!!!",
5-Jan-24,Rated 5 stars out of five stars,"For a while, I saw Google Photos as nothing more than an alternative to my system's default photo gallery app. Now I see it as so much more though. It is helpful to have photos backed up to the cloud to free up space on my phone. The intelligent features in the app are very helpful at times. It is great to be able to search my photos by location, by person, or (as I just found out) by object! The facial recognition is not perfect, but it is very good!",
5-Jan-24,Rated 4 stars out of five stars,"This is my primary app for backing up photos into my storage. I like the new features (the photo editings), and generally, the entire app. Although, one thing I've been constantly noticing is that sometimes, when I try to edit or download an image, it tells me ""Unable to edit, check your connection."" It's really frustrating because I have 0 issues with my connection expect for on Google Photos.",
5-Jan-24,Rated 1 stars out of five stars,"So, so Whist it does the function of backing up and keeping imagines safe, it just shoves all the photos into one folder/feed. If you have folders on your phone, it does not create them in google photos. It copies some to library, but only if you are synching/backing up. If you decided to free up space on your phone, then all the folders just vanish and everything is in one. So to find a screen shot you have to scrolls through 100 of photos, same for other sources. Your email isnt monitored.",
5-Jan-24,Rated 5 stars out of five stars,"Honestly, I'm impressed with the app. The main reason I downloaded it was for the backup and flexibility of that feature. The stylized photos the app creates are amazing. And the panoramas I've had created form 7 photos are flawless. You cannot tell that it's not one photo. Impressive! As far as printing an image is concerned, I imagine if you can share to a printer, it should work. Aside from that, I could not find a print function, but I do not have a printer driver & printer installed.",
5-Jan-24,Rated 5 stars out of five stars,"Google Photos is the only photo app that we consider a necessity for any mobile device. If you‚Äôve ever lost all your media files when your phone died or was misplaced, you‚Äôll understand why. While it only has minimal editing tools, Google Photos organizes your photos and videos, offers easy sharing and ‚Ä?most importantly ‚Ä?automatically backs up your entire image library to the cloud. From there, it seamlessly syncs to all your devices where the app is installed. That includes Apple phones, laptops, tablets and desktop computers; Windows computers, and all Android devices.",
5-Jan-24,Rated 1 stars out of five stars,"It was perfect, but after one of the latest updates you removed the ""Edit in"" button, which was annoying, but I could still get to it through usual editing. But now it wouldn't even let me edit my photos, because the connection is bad? I am on home WiFi, the connection is perfect, and editing any pictures has never been an issue before, even offline. It's really frustrating not to be able to edit 90% of my library (downloading the pictures did not help). Please fix this.",
5-Jan-24,Rated 4 stars out of five stars,"It's wonderful being able to access your photos on different devices and knowing they are backed up even if you lose your phone. I love the albums that go back in time to what you were doing this same week 2 and 3 years ago. The search features and suggested photo albums are helpful, too. The tools for correcting photos can be a bit difficult to use.",
5-Jan-24,Rated 2 stars out of five stars,"This app seems to be going downhill fast. It was nice to be able to browse what was stored locally, and delete easily what you didn't want to store locally anymore. Now it is all or none. I cannot choose what to leave locally Just erase all locally. I want to keep the files locally on a few apps but want to back up the files. Not to mention the clock is ticking on using this as ""free"" storage. Once you are hooked, seems you do as they say. This seems to be the trend with Google, to keep removing services, and consolidating and incorporating them into another app like was done with Google Music to YouTube Music. Totally inferior experience. And now the service will become pay as you go which will call for ever increasing amount you pay as you continue to store photos with them. Have to add that, with the removal of monitoring local storage, I connected the phone to a PC and deleted 1000s of locally stored photos., a few gigabytes. App still shows the SAME number of files I need to remove. Even after clearing the cache, it still says that I need to remove the same files to reclaim the space. Had to clear entire data, and tell the app again which folders to back up. Was the removal of a simple feature really worth in Google?",
5-Jan-24,Rated 3 stars out of five stars,"Google Photos used to be great. However, I noticed that new features added in the past one or two years tend to be buggy. For example, the small iconic preview of the videos does not work properly on my phone: it often flashes, and thumbnails of one video appear on top of another. Uploading videos is also a pain: the videos are usually not ready for download on PC after uploaded from my phone. It always says the video is being processed. I had to wait for tens of minutes or hours sometimes. I don't know what Google is doing with the video upon uploaded, maybe running ML algorithms for annotations, but why prevents users from downloading it since it is already uploaded? The same issue happens if I upload a video to Google Drive. A more recent feature is showing groups of photos 1-3 years ago. When I click on one group, it automatically goes to slideshow, which is fine. However, I don't like the full screen: I keep clicking on the lower-left corner of my phone to exit it, but the ""back"" button is not there and the screen simply goes to the next picture. I don't know about others, but it is anti-intuitive to me.",
5-Jan-24,Rated 4 stars out of five stars,"The backup feature is amazing, and makes it easy to access photos from different devices. However, it's a bummer that even if you pay for high quality photo storage, any use of the editor will crush the quality of a photo to the size of the free version. I thought I would be able to upload DSLR pics from my laptop and leisurely sort them and tweak lighting on my phone, or even from the website on pc. Nope! Not unless I want to defeat the purpose of using a real camera.",
5-Jan-24,Rated 2 stars out of five stars,"I'm honestly getting annoyed at this app. For this being the default app for my phone, it's lacking some key features such as sorting my albums. And within those albums you cannot sort either. And upon updating, they have once again cleared my bookmarked photos. I could find a better photo gallery app in my toilet. The one positive is that you can look at your photos. But good luck finding a specific one in a timely manner or doing anything beyond that.",
5-Jan-24,Rated 2 stars out of five stars,"Why is it that Google took away the most useful feature of this app from Android but left it for Apple? (i.e. the cloud icon in the upper corner of the photo thumbnails to let you know if a photo is backed up or not). It made managing your backed up photos so much easier! Now you have to guess, unless you choose to have everything backed up to your account (including all your useless and junk photos). At least make it an option to turn on or off! This isn't rocket science Google!",
5-Jan-24,Rated 5 stars out of five stars,"The save space feature is great. I love the organization. It's so easy to find pictures. You can search by typing flowers, a certain person, food etc. Because it saves to the cloud picture is a breeze when changing devices. The automatic collage maker and video clips of my child growing up that it automatically does is wonderful. I have nothing negative to say.",
5-Jan-24,Rated 4 stars out of five stars,"I know many people have said that the interface is easy to use but I find it difficult to distinguish between photos/videos that have been automatically saved and those that haven't. Apparently any photo/video that I take with my Android is automatically saved but screenshots and downloads have to be saved manually. That's perfectly fine, I just wish it had been specified during the introduction. Otherwise, I truly appreciate the service of being able to save and archive my favorite photos.:)",
5-Jan-24,Rated 3 stars out of five stars,"The ""Albums"" feature is difficult and tedious to use, and I can't figure how to make a folder. Also, it's pretty strange and inconvenient that you need wi-fi to access your photos and look at them. However, I like the ""Stylized Photo"" and ""Animation Features,"" those bump it up a star. Overall, this app needs some huge improvements.",
5-Jan-24,Rated 1 stars out of five stars,Wow finally i can search for text stored within the photos. This is brilliant. The utility of the application makes it one of my most used applications. (5 stars before the UI fix) Latest UI update: (1 star due to the bad UI) It's clumsy and unclear where the for you section went. The distinctions were so clear in the previous version of the app. I like the map view but overall it's a very bad UI experience,
5-Jan-24,Rated 3 stars out of five stars,"This app does it's job & is easy to use, plus it's free. I have only two problems. 1. I can't organize photos in the order I want. They're always listed in the order they were taken/uploaded. 2. The app automatically creates folders for photos from Snapchat, Camera, Messages, and more. STOP. I don't need all those folders. Just one big list of photos is perfect. That way I don't have to hunt through several folders if I don't remember where the photo came from. I do like the album feature though",
5-Jan-24,Rated 3 stars out of five stars,"google photos is great, but feels a little unfinished. It doesnt feel like a very ""native"" app. for example, screenshots you take on your phone are difficult (or impossible?) to access from the web version on a computer. not very intuitive organization of photos, but perhaps as I keep using it I'll come to love it. i really enjoy how it recommends photos from the past to you, and it will automatically edit great montages and beautiful photos for you.",
5-Jan-24,Rated 3 stars out of five stars,"The Google Photo Assistant is the most delightful thing ever, but the tech problems with the photos app in general started in August 2018 and have continued to frustrate me. I have almost 28,000 photos, videos, & screenshots stored in here and don't know how to move them to a safer place. The most common problem is the app disobeying the settings I have chosen. Nothing more frustrating than double-checking the settings and seeing they aren't controlling app behavior. It has a mind of its own!",
5-Jan-24,Rated 5 stars out of five stars,"I love the Google Photos app. I love the features. The animations are so neat, so are the collages. Sometimes the app will take one of my pictures and remove all the background color, and enhance the subject so it really stands out, and it is awesome! It also made a short animation of my 3 year old niece from the pictures I've taken of her since she was a baby. It's really amazing. This app does so many helpful and really great things. I'm happy I switched from the Amazon Photos app.",
5-Jan-24,Rated 5 stars out of five stars,"I've pretty much given up on my ""real"" camera for the one that's always in my pocket. Most of photography is being in the right place at the right time with a camera in your hand, and Google Photos on my Pixel 6 makes it happen. Simple as a point and shoot but more adjustable than most SLR's, it helps you make better pictures. Not enough light? Night Mode will get the shot you want. Time Exposures? Motion Blur? There's a setting for that. Panoramas? 360? Check! Video? Yeah. It's got it all!",
5-Jan-24,Rated 4 stars out of five stars,Nice app. Good way to back up your photos. I like the album feature. They are always there when you need them. The edit feature is nice. I like the Chromecast slide show feature but the algorithm is bad because it keeps showing the same pictures over and over again when there are hundreds that are never shown. Also if I delete a photo from Photos it should not delete it from my phone. Certain filles are supposed to be kept separate.,
5-Jan-24,Rated 2 stars out of five stars,"I have been using this app for years and love it. However, like other users have an issue that has started happening recently. When trying to access options for an individual photo (either swiping up on a photo or clicking the 3 vertical dots button) the app crashes with a message saying that an error occurred during installation and should reinstall the app. OnceI reinstall it works again for a short time then starts crashing again when I try to select options on an individual photo.",
5-Jan-24,Rated 4 stars out of five stars,"Well, I do love google pics. I dont care for how once you put a pic in an as album it's still in the ""picture"" section section. It's so messy. Plus it's always wanting to ""archive"" my pics of documents and screenshots. Just because it's not a person's face doesnt mean it's not important to me. Stop asking me. The suggestions to ""clean up"" make it too easy to accidentally delete/archive. I love how it backs it all up. It works great with snapbridge camera app. Transferred Samsung S9 easily.",
5-Jan-24,Rated 5 stars out of five stars,"Not great. First off, you need an internet connection to view all your photos, which is not great. Second, the free space offered in the cloud isn't really that much. Once in the cloud not all photos can be downloaded back to device, which is kind of a big deal. Downloading photos back from the cloud files are compressed/smaller. Would be nice to have a lock feature/vault for private photos. One thing I do like about it is, many of my photos would have been lost to time without it, so...",
5-Jan-24,Rated 5 stars out of five stars,"This gets a solid 5 stars from me. I love the options available on Google Photos. I've used the search by name, face, date, location, and even theme features to find the photos I need. I have thousands of photos stored so these options are important to me! Another thing I love is that it suggests and creates movies and slideshows of my photos when I take several at once. Equally important is the ease of sharing albums.",
5-Jan-24,Rated 3 stars out of five stars,This app is great. You can see all your photos and it is better than any default android gallery and it's really handy to back up your photos. The problem is that it is extremely hard to organise your photos. For example there is no way to delete a photo from the cloud without deleting it from your phone as well. WE NEED THIS FUNCTION GOOGLE! If this feature was added this would easily be 5 stars.,
