date,rating,comment,category
5-Jan-24,Rated 4 stars out of five stars,Hello I am editing my review after one year here üòÄ I would like to tell you that this app is very good for storage of your old pics in your Google account. I m using this app since 3 years and now I haven't see any major changes or modifications in this app ...so I request to Google photos to include some more exciting features in this app. üòä Thank you!,
5-Jan-24,Rated 2 stars out of five stars,"Annoying app missing even basic editing features like the ability to mirror images. Edit: Useless response from Google below, who apparently don't want feedback to their own app being left in their own app store, so post an off platform link that isn't clickable on Android devices.",
5-Jan-24,Rated 4 stars out of five stars,Great app for editing photos. I would give 5 stars except since getting my Pixel 7a there is no longer an option to flip a photo! It's a tiny feature but as an artist I use this all the time to check my drawings.,
5-Jan-24,Rated 1 stars out of five stars,"Man, you should have seen what I had to go through today just to try and back up a couple hundred selfish and a couple thousand screenshots!! It was rough. I'm told I don't have google one and need to pay to upgrade, even though I've paid like 5 times on 3 different accounts, or something like that. Furthermore, I'm now expected to pay $1.99 for the VPN even though I know it comes with the 100gb Google one plan. I know it just the the felonious admin hacker playing games with my account.",
5-Jan-24,Rated 1 stars out of five stars,"Every time I open it, it prominently shows me old photos I really don't want to keep seeing. There is no way to turn that ""feature"" off. Why do Google always have to add horrible and intrusive features to otherwise useful apps?",
5-Jan-24,Rated 2 stars out of five stars,It is not at all grouping the faces i had to do manually i had more than 6 thousand pics in it and it is not grouping the faces and showing all images of the person in the same place try to rectify this it is A very use full feature in Google photos. Mainly I need it,
5-Jan-24,Rated 3 stars out of five stars,used the markup feature a lot for photos and screenshots but the last update seems to have broken it. now the markups sometimes work until the screen loses a quarter of the image and the previous markups disappear. sometimes it doesn't work at all.,
5-Jan-24,Rated 5 stars out of five stars,"Love it! I never backed up or used any Google photo features until recently and I could kick myself for not doing it sooner. Fairly easy to use and the options to make a movie, collage, and memories are something fun to see.",
5-Jan-24,Rated 1 stars out of five stars,Ok. All of a sudden when I go to Google photos it opens for about 3 seconds then it closes! It brings me back to the app page where I can uninstall or stop n then it has the reviews n all that... Basically like the app store page.,
5-Jan-24,Rated 4 stars out of five stars,"Great app. I like that you can create album and name people (and pets!). Also enjoy the spotlight on a day feature. Only complaint is that it would be nice to be able to delete photos when they come up in the spotlight on fay, would make it easier to get rid of random photos you don't want to keep.",
5-Jan-24,Rated 1 stars out of five stars,I'm having an issue after changing to Pixel 8 pro recently. My photo app keep backing up status but it's not really backing up any of my current photos. I have stable wifi connection. I even tried with data plan but still the same issue. I've cleared cache and data. I had even uninstalled and reinstalled the photo app. Updated to the latest version but still the same issue where it's not backing up my photos. Please do assist me. No photos are being backed up ..it just states Getting ready,
5-Jan-24,Rated 5 stars out of five stars,A great repository for photos with some sophisticated editing features. Images back up from phone and other devices via same Gmail address. Works for me!,
5-Jan-24,Rated 4 stars out of five stars,"Actually the running good very nice ,good feature but thing to see your update I usually upload my photoes on Google photes double downloading it other Google photoes are awesome",
5-Jan-24,Rated 1 stars out of five stars,"Some photos are invinsible, i can see the photo on the folder i made a year ago but when I'm trying to look for it at photos page, it's not there, and few of photos captured in Feb but in Jan, Home page not working well",
5-Jan-24,Rated 5 stars out of five stars,"This app is one of the best, if not the best photo gallery on Android phones. But I feel that the new feature of'locked folder' is cool but I feel moving files to the locked folder should be done without internet connection like other apps that perform similar function. Thank you.",
5-Jan-24,Rated 1 stars out of five stars,"Can't use advertised pixel 8 features without sending all your photos to the cloud (and buying cloud storage). Not sure what the tensor chip is for if you are not allowed to use it locally. Shame on google for the false advertising and shame on them for the endless attempts at getting more and more of your personal data. Remember when their corporate slogan was ""don't be evil""? Feels like a lifetime ago.",
5-Jan-24,Rated 5 stars out of five stars,"Absolutely love the app. The memory feature, animations, shared albums, face recognition, all these features are excellent.",
5-Jan-24,Rated 4 stars out of five stars,"Google needs a camera app! Hear me out, Google Camera- spin pop out wheel menu on left or right side optional to choose where it's at: choose what album or new album to put all photos in while taking photos. So all my work photos stay there all day and I can switch to family when it's family photos or vacations etc ... So I don't have a mix of weird work stuff with family stuff when trying to just see family ones.",
5-Jan-24,Rated 5 stars out of five stars,Google photos features is so cool because mobile gallery photo mistakenly delete but Google photos this photos save her memory.... I am very satisfied this app.,
5-Jan-24,Rated 5 stars out of five stars,It's a real home üè†üè° of memories that backs up first quality gallery with more beautiful and wonderful features... automatic edit with more of previous memories.a very good üëçüòä app that I have never seen before.thanks to GLLC,
5-Jan-24,Rated 4 stars out of five stars,"Idk what ppl are yapping abt the app works fine for me ü§∑‚Äç‚ôÄÔ∏?besides when we have a photo and it's like there but when we wanna send it to someone it doesn't show up In the gallery section of messages, that's my only issue. Other than that it's fine",
5-Jan-24,Rated 1 stars out of five stars,"The auto enhancement of Google Photos which is not able to be opted out of or turned off is terrible. If I wanted auto enhanced /touched up photos I would choose to do so in editing. I dislike how it automatically changes , rounds and softens facial features of everyone, including children and infants. We don't want or need auto changes to faces to be more aesthetically appealing or look a certain way.",
5-Jan-24,Rated 1 stars out of five stars,This app is crashing after using editing option please help give me a loading screen then as suggestions and closes automatically,
5-Jan-24,Rated 5 stars out of five stars,Hey it's pretty good I see all kinds of pictures from adult websites and I make a screensaver for a slide through with them I like it I like it a lot it's very nice I like the girls with......,
5-Jan-24,Rated 1 stars out of five stars,"The app stores photos, however I have watched photos I just saved from social media suddenly vanish when I open the app. Additionally, several albums from my Samsung Galaxy S9 phone cannot be found under the ""Library"" section of the app, however the albums are accessible if I am attaching photos to a text message or email. I suppose I should be thankful that there are no ads or in-app purchasing, as compared to other photo gallery applications, but this application is far from ideal.",
5-Jan-24,Rated 1 stars out of five stars,"What happen to backup and sync on phone? I no longer get to sync across all my devices, only backup available. I can however still sync from tablet to my PC. But not able to get them on my phone. Samsung S21+ Edit. Don't know where to fetch the so call ""article"" to read from my desktop. Even on phone, no link. So reply from support saying to check on ""article: goo.le.... "" is pointless if users don't know where or how to look for it. Quit using/ letting fake reviews to push away legit users. TY",
" 2024""",Rated 1 stars out of five stars,"My library folders are broken. I can't delete or move any photos that appear in my library folders, including ones that the phone creates itself, such as ""screenshots"" or ""downloads"". If I try to delete a photo in these folders, it says ""failed to trash"". If I try to move, it says ""trouble moving 1 item"". This is recent. My app and OS are up to date. EDIT: I fixed this by uninstalling the just recent update. VERY DISAPPOINTING GOOGLE.",
5-Jan-24,Rated 1 stars out of five stars,"After I reset the face grouping because it's totally wrong on recognizing, the system wasn't make it again. Why?.. I paid for the features and the storage, but it's gone! 03-02-2024 And it happen again üòÆ‚Äçüí?
January 5",
5-Jan-24,Rated 1 stars out of five stars,"What the hell is wrong with this app? Even if selected it all to download, it only restore some of my files, so bothersome manually selecting everything, can you just at least put ""select all"" and ""download all"" as its features?",
5-Jan-24,Rated 3 stars out of five stars,"Please the function of editing photos isn't working I have tried, I updated the app But when I to crop and I hit the save button It is always replying Unable to save changes",
5-Jan-24,Rated 3 stars out of five stars,Why dont I rate 5‚≠êÔ∏è? I can't prevent the Screenshot folder from backing up to Google Photos and its very annoying not to have that feature.,
5-Jan-24,Rated 1 stars out of five stars,"Worst system ever for backing up photos. Remove the miserable notice for storage being ALMOST full, because it sends 80 emails a month and 20 notifications about it when it's not even 70% full, add the ability to remove photos or videos from the cloud WITHOUT DELETING THEM FROM THE PHONE, and add a better local album system because the current one is hidden away under several menus. As a pixel user, being stuck with this is a garbage fire of an experience. Moved to KDrive by Infomaniak.",
5-Jan-24,Rated 5 stars out of five stars,"Love the simplicity of an auto backup while the phone is at rest. Works well across my tablet,phone and PC ^>^",
5-Jan-24,Rated 1 stars out of five stars,Nearby share was a very useful feature. I don't get why you removed it. Gonna switch to iPhone for airdrop ‚ù§Ô∏è,
5-Jan-24,Rated 3 stars out of five stars,"Why did my ""sharpen"" feature in my adjust/editor stop working all of a sudden? I've tried EVERYTHING that google suggests to fix it & nothing works.",
5-Jan-24,Rated 1 stars out of five stars,my pictures are not organized at all it takes 30 minutes to find anything cuz it's organized by random dates and it goes back years. absolutely unnacceptable,
5-Jan-24,Rated 2 stars out of five stars,"I liked the slight change on layout even it's only on photos, hope to see the change also work on library.",
5-Jan-24,Rated 1 stars out of five stars,Magic Eraser doesn't work it just says finding suggestions and just goes back to the tools menu I bought the Pixel phone for NOTHING üòî,
5-Jan-24,Rated 1 stars out of five stars,"Persistently nags you to enable notifications, constantly interrupts you to tell you about new features. Used to be the best photos app but now just gets worse every version. Edit: this canned response shows how little they value the users. I didn't need help, I needed you to stop nagging me to enable notifications",
5-Jan-24,Rated 3 stars out of five stars,Locked folder doesn't work in my phone Always show This Feature isn't available in fully Managed device Google Team please fix it As soon as possible,
5-Jan-24,Rated 1 stars out of five stars,"Imagine thinking you are a great dev on a great team but your software doesn't check THE LITERAL DOWNLOADS FOLDER for pics. Absolutely worthless. Actually, less than. It's actively antagonistic to the user. Unacceptable.",
5-Jan-24,Rated 3 stars out of five stars,"Please turn off the ""play memories"" feature above every album. I do not appreciate your choices. In addition, I really do not like the advertisements for ""Google One"" that take precedent over normal editing tools! $2 a month is not a bargain, and I dislike being unable to block the multiple features available only for this fee !",
5-Jan-24,Rated 3 stars out of five stars,"Some annoying features: 1. you can't stop screenshots/screen recording from being backed up. 2. You can't delete backed photos without it deleting it from your phone. (Sometimes I wanna clear my Google drive photo but i want the image on my device storage, however I have to go to the Google photos web to delete the Gphoto storage that way it doesn't delete both) 3. Long videos that are backed up don't download via app and i have to go to the web version from my phone to download them üòë",
5-Jan-24,Rated 5 stars out of five stars,"I love Google photos! One suggestion-I would love to see a feature that allows for organization of albums. For example, I would love to be able to group all of my vacation albums in a file folder of sort. This added layer of organization would help to keep my many many albums sorted and easier to locate.",
5-Jan-24,Rated 1 stars out of five stars,"Was great until paywall access to photo edit features began. Can't even rename a photo. Time, Location, direction camera facing, device information imprinted on photos no matter if you have this information off or incorrect on your device. Cut and paste deactivated here in review forum so easily checking your fix links without having to write them out by hand is a joke too. Camera will now not work with location turned off. Still no ad free, support fixes, or free feature additions. Boo",
5-Jan-24,Rated 3 stars out of five stars,"Somehow, to free up space in my Google photos, I clicked on something and now most of my photos are gone from my gallery. I've googled (pretty ironic) how to get them back to my device, but the instructions I'm given don't match up to my photo app. It's telling me to highlight then click export to device. But there is no ""export to device"" button. Very frustrated.",
5-Jan-24,Rated 1 stars out of five stars,"Facing problems with saving frames, the app keeps getting worse even after taking the subscription, the features don't work.",
5-Jan-24,Rated 1 stars out of five stars,"The worst gallery app that I've ever used. It came as default on Motorola phone and it's such a downgrade from my Samsung and it costs money to access basic features. They're also exploiting notifications to advertise for premium, which is NOT what notifications were ever meant for, which is intrusive and obnoxious, not to mention ABUSIVE.",
5-Jan-24,Rated 1 stars out of five stars,"How to see all photos of my existing albums? Photos are missing from them and I only find them on the Photos section but not in the Albums. When open an album there are only a few photos, the others are missing?! This is frustrating!",
5-Jan-24,Rated 4 stars out of five stars,Everything is perfect but please please can you guys add password feature for privacy....it will be very appreciated....,
5-Jan-24,Rated 5 stars out of five stars,"Great app, BUT it needs a setting were you can enable/disable auto video upload. Amazon photos has this feature. Why not Google?",
5-Jan-24,Rated 1 stars out of five stars,Horrible backup system. All my photos are gone from Screenshot folder and important documents,
5-Jan-24,Rated 1 stars out of five stars,I don't like using Google photos because now since it's been constantly updating all my pictures that's are backed up in my photos I CAN NOT SAVE NONE OF THEM TO MY PHONE I can only take a screen shot of my pictures but Google photos won't let me save them to my phone,
5-Jan-24,Rated 4 stars out of five stars,"This app is quite good but there are some shortcomings in it like ‚Ä?If we share our photos with someone by making them partners then it should be separate that we cannot make more than one partner, we can make partners with as many people as we want, please bring such a feature.",
5-Jan-24,Rated 4 stars out of five stars,"Would have given it 5 star if I they have an easy way to remove duplicate pics from the drive straight without manually removing it one by one. Also this is 2024, can you enable a delete button from featured photo reminder so I can delete it straight if I don't like it?",
5-Jan-24,Rated 2 stars out of five stars,"If you want to re-download a bunch of photos you have to do it one at a time... it's embarrassing that a simple feature like ""download all selected photos"" is not there",
5-Jan-24,Rated 5 stars out of five stars,Trying to play videos in the Google photos app is just a bad experience...it's been like that for months...lag...stopping...yet when I play them on Samsung gallery...no problem whatsoever...I shouldn't have to switch out the app...I'm on an S20 FE...so like...let me get some stability up in here üôà *Edited 23rd Jan* Ok so now it's fixed thanks to your advice üëèüèª,
5-Jan-24,Rated 1 stars out of five stars,"I hope they have features that will import photos from google to gallery. I lost all my photos from my gallery and it's all located in my google photos, so I can't access them directly from my gallery.",
5-Jan-24,Rated 4 stars out of five stars,This app is good....but would be better if it had an option in the edit feature to flip photos horizontally or vertically.,
5-Jan-24,Rated 5 stars out of five stars,"I like your features, I just don't like that once it is saved you can not go back and download the individual ones you want after they have been saved.",
5-Jan-24,Rated 1 stars out of five stars,Never press the 'Free up space' button unless you want all your pictures deleted and only have them online with bad quality. You can only download it back one by one,
5-Jan-24,Rated 5 stars out of five stars,"I won money on casio app and should be able to screen shoot it and Google should be able to protect it for me if phone lost or stolen so I can prove I am who I say I am with the casino and Google should have lawyers to ensure payments are given to Google people that use its app on mobile cell phones devices. That's what's up. 72,000 plus is what I won some I cashed out on cash app , Google pay ? And never got anything....Google should be responsible for the money cashed out to google pay",
5-Jan-24,Rated 1 stars out of five stars,The edit feature now crashes the app. Now I can't fix my screen shots I take with my phone or do any adjustments to any pictures.,
5-Jan-24,Rated 2 stars out of five stars,"I'm having trouble with the magic eraser feature. Anytime I want to edit a photo or video using the magic eraser feature, the app force to close. I hope you solve this",
5-Jan-24,Rated 2 stars out of five stars,Continuously updating but really never adding new functionalities. Certain editing features are in Snapseed but have never been imported here. Wondering why?,
5-Jan-24,Rated 1 stars out of five stars,"You can sign in your google Account without your email address or phone number, however it will release some of your personal database and the same issue with the email address for the first thing you have for a year or two. I would need some help on some of these issues with Google Photos application Android phone along with the Google Account of my email being displayed in public.",
5-Jan-24,Rated 5 stars out of five stars,Great App! The photo library and collages are an excellent feature when trying to group photos or send them to friends or family.,
5-Jan-24,Rated 5 stars out of five stars,"Every thing looks good, lost lots of my photos by a spam who stole my old long time FB Page, through stealing my # when I deleted my WhatsApp Acc. So I want to be far from that Gmail account that was used in the time of photos then. I GOT A new phone and number, started all new FB , then I noticed the hacker had a lite FB copying my new one. On my new phone, I DELETED IT.",
5-Jan-24,Rated 2 stars out of five stars,"What happened to my Google Photo app, it disappeared from my home screen, it shows it's installed but I cannot access it from anywhere. How do I get the Photo app back on my home screen?",
5-Jan-24,Rated 1 stars out of five stars,PAYING $2 A MONTH AND CANT EDIT? Why do you advertise that I get 100gb of storage and I can unlock and edit pictures. But then you turn the editing power off after I pay for the plan after about 2 weeks. I would like all my money refunded at once. It's bad enough you got a spy on me. If I talk about Indian food that comes on my screensaver on my Google TV or if I talk about bird photography a bird pops up on my Google tv. You sell my data make money on it and then charge me for a subscription,
5-Jan-24,Rated 1 stars out of five stars,I love the app so much since it gives adorable memories however I get challenges when I want to download the photos am unable to download unless I screenshot which makes the photos lose quality and I can't download my videos too,
5-Jan-24,Rated 1 stars out of five stars,When opening Google photos a screen opens wanting me to give Google access to my photos. I have been using Google photos for more than 5 years. Now I cannot seey photos .,
5-Jan-24,Rated 1 stars out of five stars,"keeps separating my pics into different files so I can't find them worst photo gallery app ever, losers can't even install my old one,,, fffff you sooo much, marking my life difficult why can't ALL my photos be in one menu??????!?!!!",
5-Jan-24,Rated 1 stars out of five stars,"Cant select specific folder to backup inside DCIM folder. Screenshot and other apps save photo inside the DCIM, and I have no option to exclude them.",
5-Jan-24,Rated 1 stars out of five stars,You telling me this is the photos app my camera opens automatically and it doesn't have a flip invert picture edit feature? My god this is so insufferable,
5-Jan-24,Rated 4 stars out of five stars,"Dear Google, kindly update new feature for remove duplicate photos and videos in backups because, many people suffer backups twice and thrice times of photos and videos.",
5-Jan-24,Rated 5 stars out of five stars,Easy to use and access photos and videos without having to search or seek videos. Love the locker it's convenient to use my phone as the password Gr8 features,
5-Jan-24,Rated 1 stars out of five stars,The google are automatically deleted . I'm very disappointed. I'm already backup the Google photos but they pictures are deleted why ??? Update the new features to restored the pictures,
5-Jan-24,Rated 4 stars out of five stars,I want playback speed for videos. Kindly add that feature too. Other than that it's really nice.,
5-Jan-24,Rated 4 stars out of five stars,"Pretty good, but I think it needs a feature to delete photos from the cloud without removing them from your device.",
5-Jan-24,Rated 2 stars out of five stars,I lose every photo I ever wanted to keep after reinstall the backup part of system waste time put keep sakes on your sd card for sure system with passwords sucks think it got better now you don't need password to delete everything isn't that great my xhr gets it trys password system to go in her account. usses my son for backup recovery did help no she swished down a fifth vodka it her effort to deal with breaking my tablet up lol xgf tablet o I come rescue and break up her tablet iphone an her.,
5-Jan-24,Rated 4 stars out of five stars,The app is generally good. But i would like some things addressed. Where are my photos from whatsapp going? For some reason my WhatsApp Images section is not getting updated eith new photos even if i have backup on. Please tell me what to do.,
5-Jan-24,Rated 1 stars out of five stars,"I pay for 1 plus and some of the features when I use them the app crashes, I was trying to use magic eraser today and it just crashes tried 4 times still same thing Please follow up on these",
5-Jan-24,Rated 3 stars out of five stars,Slow application. Even local storage photos take time to load. Samsung gallery is good with more features and fast loading.,
5-Jan-24,Rated 2 stars out of five stars,Google photos me. Locked folder not working plish help you. This feature isn't available on fully managed devices. Show notification. Plish help me,
5-Jan-24,Rated 4 stars out of five stars,"A good app but lack some more advanced editing features, like changing the background, change the geo properties etc.",
5-Jan-24,Rated 1 stars out of five stars,"Can you remove the partial upload feature? That feature is very bad, my photos which were previously not blurry became poor quality.",
5-Jan-24,Rated 1 stars out of five stars,"GOOGLE PHOTOS SUCK WITH MONOPOLISTIC FEATURES LIKE YOU STILL CAN'T DELETE ALL PHOTOS AT ONCE! IT'S NEARLY IMPOSSIBLE TO DECIDE / SEGREGATE THE UPLOADED & UN-UPLOADES PHOTOS! LATELY, I'VE STOPPED BACKING UP MY PHOTOS & REDUCED MY USAGE OF THIS APP ALMOST TO ZILCH & STARTED EXPLORING OTHER ALTERNATIVES.",
5-Jan-24,Rated 1 stars out of five stars,"Very very poor, can't save my screenshot and edited photos on my device Infinix 30 pro, and im not getting any response from you.",
5-Jan-24,Rated 1 stars out of five stars,"Chaotic interface. If you take a screenshot, you cannot find it under today and you can't find it in the ""search for"" screenshot.",
