date,rating,comment,category
5-Jan-24,Rated 1 stars out of five stars,"Still a good app, but shows a full screen update message every time you open it (exactly 1 month after updating). Also, if you have cloud backup disabled, it sometimes nags you to enable it, and to skip it, you have to restart the app, as saying ""NO"" to it, it will take a random amount of photos and upload them to your cloud anyways. Can you kindly stop with these intrusive messages? Your app works fine as is. What about an option to select the default screen on startup (for example: Library)?",
5-Jan-24,Rated 1 stars out of five stars,"Please. Stop. Replacing. My. Feature. Photos. It's really frustrating when Google keeps changing the feature photo I've set for some people, especially when they change it to a completely different person, and then I have to clear out a bunch of wrong photos to find the one I had previously selected. The feature photo shouldn't change unless I specifically update it. I've already submitted this as ""feedback."" I don't want to submit more screenshots. I just want it fixed, please.",
5-Jan-24,Rated 2 stars out of five stars,"Unwanted features that can't be turned off. I don't want a ""Best of"" popping up for every month. I don't want little prompts to ""blur background"" popping up on every single photo as I swipe through looking at things. The problem is not the features, but the fact that Google seems to determined to force them on users. Please give us the option to turn these things off.",
5-Jan-24,Rated 3 stars out of five stars,"I love this app because of the 'Memories' feature. It's such a special and important function for me. But there's two things about using it which frustrate me to no end! 1. No 'delete' option for individual pictures/videos, or the entire 'memory'. 2. No 'move' option for the files/memory, if I want to create a folder or move items to an existing folder. These functions would allow me to tidy my files up a little each day; instead, their absence just causes me daily frustration instead!",
5-Jan-24,Rated 3 stars out of five stars,"Google Photos app is really nice, except for the fact that it's always complaining it needs to update and the app is huge. I'd rather use the memory on photos than on apps, thanks. // Edit: Yes, I have automatic updates disabled. That is why the app detects it is running an ""old"" version and on startup makes a full screen prompt to update, which is ... well, not really usable.",
5-Jan-24,Rated 4 stars out of five stars,"""Improvements"" to photo editor have made this app unusable. Worst update ever. Uninstall and keep v.4, there is no reason to update this at all, they changed all the photo editing controls, removing the easy to use [color controls combined & lighting controls combined] sliders trying to make it ""better"". Now it's all preset buttons and you can't slide the live editing controls, WHAT WERE THEY THINKING?? Uninstall and reset the app to original version, end of story. Updates only make the ads work",
5-Jan-24,Rated 1 stars out of five stars,"Ridiculous that we can only create albums with an account + sync. Without an account it is a list of system folders with photos. No search, no albums, no grouping or organization feature of any sort, no facial recognition, no features, no nothing. I just wanted to group my photos in albums to download to an HD on the future without using up my Google Drive storage space.",
5-Jan-24,Rated 4 stars out of five stars,Edit; not a fan of the recent updates and how they've moved around the buttons and changed the layout. It looks a bit clunky and I find myself tapping where things used to be. It's a bit annoying. Also I'm not a fan of these annoying forced app updates. Nobody wants an app to take up MORE space on their phone! There is NO REASON why I needed or wanted to update this app.,
5-Jan-24,Rated 5 stars out of five stars,"Love it ,when they put together photos for video memories. I've ordered photo books too ,you can get hardback or regular . I'm not sure if they offer a disk. That's something I'd love to get .I have to many photos to keep on my phone, putting them on a disk would allow the whole family enjoy them on our big screen tv üòçü§©,and allow me not to have to pay for extra space. Anyone thinking about ordering from Google photos,can be assured that it's quality photos and it's fairly priced too. ENJOY",
5-Jan-24,Rated 1 stars out of five stars,"This app just keeps getting more annoying. I really wish there was a way to roll back to 2019 version. Really frustrating to have ads for a product I pay for constantly presented. Google's response doesn't correspond to any of my issues Redesign is terrible, ads front and center, no way to disable highlights which I don't care about, or the location sucking maps features. Also apparently Google didn't even read the review",
5-Jan-24,Rated 1 stars out of five stars,"Edit: if I could I would take away the one star because of then ""bot"" feedback. I don't have issues adding photos or achieving them later on. I have a problem that when I'm adding multiple pictures to an album I have to re-sekect then again just to archive. There is not a single ""button"". No option to add photos to a folder and in the same time to archive them. It's primitive and has only very basic options. I'm wondering how productively people can use it to manage their collection of photos.",
5-Jan-24,Rated 2 stars out of five stars,"Whatever's happened in the most recent update has knackered the ability to add text to images in the editing features. I can get the words on the image but controlling the location and sizing has become a pain. Assuming this is investigated and fixed, it would be nice to see the text autofill the box size fully rather than just on height. Otherwise it's a decent photo storage app and I'm quite happy using it.",
5-Jan-24,Rated 4 stars out of five stars,"Mostly good, but I have 2 main issues. Navigation to albums is made more difficult that it needs to be; or should be. Instead of a single press to get to an album menu (navigable from the bottom bar) this app desires that you should navigate to library, and then select on all albums if the album you seek isn't within the first handful of options. Not good. The app also keeps begging me to ""backup my photos to drive"", despite having selected no. Remember my choice, and stop trying to steal data",
5-Jan-24,Rated 4 stars out of five stars,"I really wish there was a way to redownload backed up photos and videos in bulk. There are many gallery-cleaning apps that allow you to go through your camera roll and swipe to delete/keep items, which is something I really need because I'm running out of storage, but they can only access local files and the majority of my images are stored in the cloud instead of my device. Alternatively, if the app had a built-in sorting feature. Except for that, it's great!",
5-Jan-24,Rated 1 stars out of five stars,"The worst photo app ever created. I've created a separate folder for photos that I want to upload. And what ? App doesn't see this folder when I open 'photos on device'. No clearing cache or restart helps. So I've picked all the photos and selected ' upload to Google photos'. Where are these photos now ???? In the Photos tab, everything is mixed up! Uploaded photos and photos only on my device are shown. And not is the correct order. This app is an embarrassment.",
5-Jan-24,Rated 1 stars out of five stars,"***F/u: when I move photos, I cannot remove photos from the camera in the library (vs. photo tabs) tab at the bottom of the page. The pic will go where it should, but leave a non-copied photo in its place (can't get rid of it).*** (original) When I move my photos to folders, they auto copy. I can archive, send to folders multiple times & a copy is STILL in the camera. I've uninstalled/re-installed & it still does it!!",
5-Jan-24,Rated 4 stars out of five stars,"Generally a good app to edit and organize your photos. Would have given it five stars, if it wasn't for the occasional freeze/crash every now and then. Observed this behavior acrose at least three different phones (pixel 4, 5 and 8 pro). On the plus side it's completely ad-free and there's only a single version that includes all the features, although some of the more advanced stuff seems to be available only on the latest Google Pixel phones for a while (eg magic eraser).",
5-Jan-24,Rated 2 stars out of five stars,"1. Why don't you put search button at the top of the screen, like all other Google apps?.Why make an exception. It's counter intuitive. 2. Sort the album. It's difficult to choose if you have a lot of albums. 3. Let people know which picture goes into what album. This info is available in browser, not in the app. Please add a simple photo organizer feature, i.e. to move the physical files in one album to other folder. This will help a lot for backup. Thanks üôè ...",
5-Jan-24,Rated 1 stars out of five stars,"Works fine for the most part, until you try using the new enhanced features on a Pixel 8 Pro. One major bug I've encountered that hard-locks the Google photos app, is using the Audio eraser feature on a Video Boosted video. Clicking ""save a copy"" after the edits locks the app up, and requires a phone restart if you want to use the app again. Keep trying guys, you're almost there.",
5-Jan-24,Rated 4 stars out of five stars,"It has no editing features for videos. Please provide some basic features like to adding music,theme, effects,etc available direct with one tap of edit icon.(Edit: Google updated photos by adding music and effect options, Thanks however they also need to be improved),Also Object extraction is a part of every other smartphone UI,it's just missing on a smartphone powered by Google AI.Such basic features should also be available on pixel. Thank you.",
5-Jan-24,Rated 2 stars out of five stars,"Takes away control. ""Features"" are forced on you even when you expressly turn them off. With back up turned off it'll still back up photos if you move them to an album. Albums are a painful experience in and of themselves. The UI is a mess, not intuitive in the slightest. Going into the cloud to examine and organize is extremely slow even on fast home internet or 5G. Adding features is fine just stop anticipating what I want and let me control my own device and photos, stop controlling me.",
5-Jan-24,Rated 1 stars out of five stars,"Auto HDR is now a feature when viewing pictures in this app with the latest Android and Samsung operating systems. There appears to be no way to turn this off. In the last version this did not occur. It is VERY distracting to see the colors and brightness of a photo completely change while looking through your pictures, and never for the better. Please allow us to turn this feature off.",
5-Jan-24,Rated 2 stars out of five stars,"It is a fairly good program but there are a couple of things that really bugs me: - it keeps backing up my screenshots even though I have nothing ticked in the backup settings = just the camera roll should be backed up - looking at my photos in Google photos on my phone, I can't delete a picture from Google photos, without also deleting it from my device. - face recognition, it is not possible to tell the app that that this is person A not B. Edit- suggested solutions are not within the app :/",
5-Jan-24,Rated 1 stars out of five stars,"When I moved my photos to Archive, it deleted all of my folders that helped organize the Messages, Camera, Screenshots, and Videos. It says that I have a total of 2 photos when I have over 100. When I try to delete some photos, in les than 30 minutes they will appear again. When my storage space was full, I pressed the free up space button in utilities and it deleted the rest of my photos. Please fix this. Overall I hate this app. But it is the only app I have to store photos, videos, ect.",
5-Jan-24,Rated 2 stars out of five stars,"An okay app but deliberately uses underhanded tactics to push unwanted features. Best example is the backup feature. Turning off automatic backup means receiving reminders to backup regularly. If you decline the backup a second screen pops up repeating the offer; accidentally hitting the wrong button commences the backup with no way to cancel. To undo the action one must log on with a computer and delete items individually (no ""select all"" present). Sketchy practices from a sketchy company.",
5-Jan-24,Rated 1 stars out of five stars,"Really annoying app, first, what dictates a photo being in the ""Photos' section and not the Library? Feels random and I don't feel in control of it. Second, when I turn off backup I did it because I wanted to, why keep asking to turn it on? Then when I say I don't want to back up, it then prompts again to back up manually with a load of images pre-selected, I'm pretty sure I said no?! Nowwhere in settings to stop this. Pretty infuriating.",
5-Jan-24,Rated 1 stars out of five stars,I was really disappointed when I found out tagging is not allowed. This feature is really basic and all other apps have that. We have a lot of images and we need to find them fast. That's what tagging is for. Not a lot of time is spent on making the app. It's just made for money. :( Update: you cannot even email any photos by tapping share. It's getting worse. Update: you can't even copy a photo easily on this app. Very unorganized! Getting worse! It deletes your photos without permission. üò≠,
5-Jan-24,Rated 2 stars out of five stars,"Buggy and intrusive. If you only want some photos backed up, forget about it. Even with cloud backups disabled, Photos will still crawl through every folder on your phone to find photos, then back them up to the cloud without your permission. There is no way to disable this. For Google Home devices, photo frame capabilities are very problematic. Albums will refuse to update when more photos are added. Newer albums won't even show up as selectable.",
5-Jan-24,Rated 3 stars out of five stars,"The app is ok, but the search capabilities are very limited, coming from Google. Advanced users should be able to create more capable searches, such as finding pictures taken by camera X or Y, or finding pictures that are in the intersection of 2 albums, or searching the difference between albums, finding pictures that count towards your quota vs not, filter by backup quality... These are a handful of examples that I've needed in the past",
5-Jan-24,Rated 2 stars out of five stars,"I had initially rated the app 5/5 in 2021 when all I did was view photos quickly. Now even with a premium membership for storage, the features I have access to is very very limited. The edit functionality takes ages to download the video and render it. The inshot Integration is an epic fail. I feel like I'm not using a tested product. I'm a PM myself and these are basics before a release! Please don't make features available only on paid services and not try the user journey yourself once.",
5-Jan-24,Rated 1 stars out of five stars,"Absolute garbage, takes forever to load photos doesn't properly display folders, doesn't allow for a streamline view, instead you have to scroll forever because some garbage feature that clusters by date which you cannot seem to change in settings. I cannot believe this is the default gallery for this damn phone. Absolutely horrendous app, constantly prompting you to pay for more storage when what it offers at a baseline is God awful. Would not recommend, would never recommend.",
5-Jan-24,Rated 1 stars out of five stars,"I have Google One subscription. When I open my photo from the Google photo and choose magic eraser, it will give a loading page for about 3 seconds, and then the app is closed. This is disappointing, as the core feature that I want to try after purchasing the Google One subscription is the magic eraser feature from the Google Photo. Please fix it.",
5-Jan-24,Rated 2 stars out of five stars,"Can't believe you guys got rid of one of the most useful features of the app - the map. It was super easy to find a photo if you knew where it was taken, by looking at the map and picking it out from the location. Not surprising though, Google always kills off the most useful features. It's like you get pleasure from it. You guys were cool when you had the ""Don't Be Evil"" motto.",
5-Jan-24,Rated 1 stars out of five stars,"This app is absolute trash. When I download a photo, it gets thrown into a random folder. I download photos several times thinking it didn't work. No, this trash app put them in a folder and not the main album. The memories tab is also useless and shouldn't be forced. I don't care about several random Facebook photos from five years ago being spotlit for no reason other than the date. Also, transparent PNGs end up in a weird black box instead of transparent. Don't respond.",
5-Jan-24,Rated 5 stars out of five stars,This is one of the best apps for photos. Live album is too good. It recognizes photos from the camera store and organises in the album without an error. I have my kids album and anytime i click a new photo it is able to to select her pic and add to album. Update : One more feature should be added. It should segregate photos which are not part of any album. It will be easier to clear clutter.,
5-Jan-24,Rated 3 stars out of five stars,"I like it; sharing is good. BUT I wish Google allowed more storage. You can fill 15GB pretty fast. I also wish Photos didn't keep trying to ""back up"" EVERYTHING from my phone! I want photos on my phone's SD card kept separate from the few I manually upload to Photos. Worse, if you use Photos to delete a photo on the phone, it doesn't go into (restorable) phone trash but a weird Photos deleted folder. And DON'T hit the ""eject SD card"" button in Photos! Just use a homescreen shortcut not the app.",
5-Jan-24,Rated 1 stars out of five stars,Updates make experience continuously worse. Live photos don't function properly and can no longer be shared or saved as videos even if uploaded correctly. Detection faulty and still cant search based on where the photo was uploaded from so devices and folder all become jumbled. Also belives screenshots are taken by the camera so if automatic backup is turned on all screenshots are uploaded.,
5-Jan-24,Rated 1 stars out of five stars,"This app had the potential to be the best photo and photo storage app on the market but as per usual Google built a minimally viable product and then gave up. Gripes? You can't search albums when adding photos to them, making this app useless for anyone with 50 or more albums. Which is anyone that's had a phone for 5 years or more. So basically everyone. There are numerous other features missing like embedded albums for organization (folder structure), private cloud folders, etc.",
5-Jan-24,Rated 1 stars out of five stars,"So Disappointed. I bought the Pixel 8 Pro on 1/4 - a switch from Samsung that I was nervous about. I have kids and taking group photos is a nightmare! I thought the ""best take"" was a cool idea. I have yet to be able to use this feature or the ""magic editor."" The app just crashes. I have tried every troubleshoot the internet provides without a fix. I contacted Google - they don't monitor that email. I posted in the ""community."" No response. I paid $1000 for a phone for these broken features. ):",
5-Jan-24,Rated 5 stars out of five stars,"This app is the best way for me and my partner and my family to keep our photos together, given there are so many, and also allow us to show each other what we've been up to. The editing features are self-explanatory and fun to use, without being too advanced - although I'm sure they could be advanced but I'm not fully aware of how to use that particular part of it. I love this app because it allows me to look at photos across devices, it's simple to use and really just the perfect photo app.",
5-Jan-24,Rated 1 stars out of five stars,"Can't stop the backup of screenshots, which is extremely annoying. No longer shows as a deselectable folder in the Backup folders menu. Note: the response from Google in no way addresses this issue specifically. It automatically backs up everything in both Camera and Screenshot folders, without listing the screenshot folder in the folder options menu that is mentioned below.",
5-Jan-24,Rated 3 stars out of five stars,love the app but it's extremely annoying that I am now getting spam messages in photos app...yall need to get that locked down...it's an app for photos not spam. there should be settings where we csn turn sharing all the way off so we don't have to receive random messages like that. I have everything turned off and I still get them. I don't like the sharing feature at all.,
5-Jan-24,Rated 2 stars out of five stars,I used to be able to take a picture and draw lines on the picture using the markup editor tool. I'd use this for marking off item on my grocery list and it worked good even when the phone went into sleep mode. Recently I believe you made changes with an update and the markup feature now doesn't work the same. When I'm using it and the phone goes into sleep mode the app loses the edits and/or has problems and makes the function non useable.,
5-Jan-24,Rated 1 stars out of five stars,"Ungodly persistent with the cloud backup notifications. If you click no, it opens the backup anyway. You have to exit out of the window to not use it. There is no such thing as the cloud. It's someone else computer. Fools old people into thinking this is a good way to share photos, JUST TEXT THE DAMN PICTURES! Navigation constantly changes, prefers the recent tab instead of the library. Literally any gallery app is better than this.",
5-Jan-24,Rated 1 stars out of five stars,"girlfriend accidentally used the free up space ""feature"", which resulted in thousands of lost pictures and videos. the only way to restore them is to search for them in google's terrible, broken search engine and download them one at a time. an hour into this process, it won't let me download any more and i've barely scratched the surface of what was lost.",
5-Jan-24,Rated 1 stars out of five stars,"I recently upgraded my storage to 1TB and it completely wrecked everything I was used to with google photos. I used it to backup pictures of important things like family in the DCIM folder. Now it automatically backs up everything including screenshots and downloads. Deleting them from the cloud storage also deletes them off the phone. I made the mistake of ""freeing up space"" and lost thousands of pictures off my phone but not all of them ended up in the cloud. It's absolutely maddening.",
5-Jan-24,Rated 3 stars out of five stars,"Okay so, my 2 star rating stays the same, but the issue now is: what ever happened to being able to CHOOSE what photos delete off of my device that are ""safely backed up""? I am an artist, and I would prefer if some photos don't get deleted in this process. This should also be reversible if done accidentally at least, or something. I love this app, but that is very inconvenient when I have specific reference photos that I keep on my screen. I also get errors after saving edited photos....:(",
5-Jan-24,Rated 3 stars out of five stars,"The updating/syncing of photos is good, however, the way of moving photos within the app is very bad. You can create albums but the search in these is very bad, the way it shows is very bad, the search is just as bad. If you move a photo from the -photos- tab, it will continue to be displayed even if you have already moved it",
5-Jan-24,Rated 5 stars out of five stars,"You know what's the reason for what I don't update the Photos app. The reason is that in the older version I have, the features are very much interesting than in the latest version. I can find the location of the place I took my photos. I can also search my photos. It also makes movies and collages for me and sends me and gives me choice so that I can save them or ignore them. I also have an assistant in that app and still after all of that, it's size is ¬º of this updated version. Remove update.",
5-Jan-24,Rated 2 stars out of five stars,"- ‚ÄúThe best photo product on Earth‚Ä?‚Ä?The Verge - ‚ÄúGoogle Photos is your new essential picture app‚Ä?‚Ä?Wired The official Google Photos app is made for the way you take photos today and includes essential features like shared albums, automatic creations an",
5-Jan-24,Rated 2 stars out of five stars,"I like that if I delete from Google photos, it deletes on my device as well. HOWEVER, I DO NOT like how there is no option to turn that off w/o losing the backup feature. Sometimes, I want to keep a picture on my phone but delete it from Google photos. I consider Google Photos my Cloud. Update 3/2- Minus 2 stars because it seems you have to pay for most Google photos editing features now. My phone's Gallery has a better editor now.",
5-Jan-24,Rated 2 stars out of five stars,"Old and annoying bug, please fix: when you edit or delete a photo in full screen mode and swipe to prev/next photo, app freezes sometimes until you tap back button. No option to flip/mirror an image vertically and horizontally. No option to resize an image. Slow navigation, rotation is slow (takes about 0.3-0.4 seconds between rotations to register a new tap).",
5-Jan-24,Rated 1 stars out of five stars,"Since the install of the March update, casting videos is not working properly in the Photos app, and across the entire platform. I have a Pixel 7 pro and am running the most current update for Android 14. Only audio comes through when casting, but the screen stays blank. Again, casting doesn't work since the March update.",
