date,rating,comment,category
5-Jan-24,Rated 3 stars out of five stars,"Does a semi adequate job with very basic things. Bad at automatic suggestions (especially bad at automatically fixing photo orientation). Super slow, especially with album management. Especially hard to share groups of photos to albums now. Just generally bad at sharing. Backup and sync works almost flawlessly, which is why I use the app. Search works well though would like to be able to, say, find the cross section of photos of groups of people.",
5-Jan-24,Rated 4 stars out of five stars,"Truly remarkable! This was the app which I was searching for. Easy to get photos clicked from numerous devices without any wastage of time, automatically uploads photos, that's what I want. Unlimited storage and high quality photos. Unfortunately, Google photos is changing its policy which can't be tolerated. A free account only get a 15 gb storage which is enough to get insufficient in a month! For that I am certainly rating four stars. That feature only gives best distinct from other app.",
5-Jan-24,Rated 1 stars out of five stars,"I've used this app for a long time, but recent changes have made it completely useless. I had used it to store images of several types, and upload to social media. I had created 'folders' for different groups of images which made it easy to quickly find the image I wanted. Now I cant even upload except from the initial photos section which has all my images and would take a long time to find the one I wanted. My solution was to use file manager so Google Photos is useless now.",
5-Jan-24,Rated 5 stars out of five stars,"I'm a photographer and I love the ease of performing basic editing. techniques that can be done in the field using my phone, when I don't have my cameras. plus all your editing and original content are synced to all devices. sharing privately, to social media, or even to Google maps is a simple task that looks very professional. just add a few filters and add-ons to your camera apps and you can get quality pictures. It even has a link button to continue editing in other prefered apps. sweet.",
5-Jan-24,Rated 2 stars out of five stars,Pretty good app so far wish that the the editing software had a few more features but works for simple basic stuff. Ok it's been a month of use and my opion has dropped from what it was originally absolutely hate the way Google sorts your photos just kind of throws them wherever it feels like and you spend huge amounts of wasted time looking for them there's got to be a better way to do photos,
5-Jan-24,Rated 1 stars out of five stars,"While this does what it intends to do very well, the ""smart"" UI is a pain to work with. The app really wants to try to hold your hand, but becomes so unhelpful in the process. Trying to have autonomy becomes difficult, for example viewing large file sizes to help manage your free space is tedious and an exercise in menu diving. I wish they would create a photo utility PC app to allow you to sync, not sync, or store offline each folder or photo. So I'm looking for other ways to manage photos now",
5-Jan-24,Rated 1 stars out of five stars,"Shocking at the minute. Can't search for photos 9/10. Wish I hadn't updated to the latest version when it told me to yesterday ü•¥ Reboot doesn't help. Various other things I've tried too. It runs so so slow. Not impressed in the slightest with the latest version. Just tried again, constant circle going round on the screen and giving nothing when searching. Internet fine with all other apps/websites so I know it's this app.",
5-Jan-24,Rated 4 stars out of five stars,"I've been using Samsung Gallery to o view/edit my pictures ever since I got my first Galaxy phone (the Galaxy S3!!) many years ago. I only recently started to use Google Photos in addition to Samsung Gallery for photo editing purposes. It has a lot of cool features that Gallery doesn't; such as the ""Tools"" feature. However, something I really like about Gallery that I wish Photos had is the horizontal and vertical tilt functions. Also I feel like the filters could be expanded and more diverse.",
5-Jan-24,Rated 1 stars out of five stars,"It lacks optimization for the largest font size and does not adhere to Android 14's accessibility feature requirements. If you adjust the display size and text settings to maximize the font size and then open Google Photos, you will notice that the text at the bottom of the application, photo and search option, is obscured by the images located just above the text. Although I cannot provide a screenshot, this issue can be easily replicated.",
5-Jan-24,Rated 3 stars out of five stars,"There's still a lot to like about this app, but the recent UI overhaul is a huge step back in several ways: - Doing any kind of sophisticated image adjustments is much more clunky and requires so many more clicks. You can only adjust one parameter at a time (e.g contrast) whereas with the old UI it was easy to adjust several things at once and see how things looked collectively as you make small tweaks. - The slider controls for adjustments work backwards - drag your finger to the left in order to *increase* the effect - The background blur feature seems to have disappeared - On my Galaxy S10, I often can't delete photos - it wants to send me over to Samsung Gallery to do that, which didn't used to be the case. - The full-screen slideshows for day in history are really unintuitive to navigate - It may be my imagination, but the Auto Enhance doesn't seem to do as good of a job as it used to I'm by far not the first person to complain about these changes. Hopefully Google listens and fixes them. Photos has been the best app/service of its type, and these changes have put a big hit on that reputation.",
5-Jan-24,Rated 5 stars out of five stars,"Straightforward app for managing and editing your photos and videos. Love the auto features such as animations, maintenance, stylized photos and ""look back"". A must for anyone who uses their phone to take photos, well...yeah, pretty much everyone. Except people using flip phones and it's pointless for flip phones.",
5-Jan-24,Rated 3 stars out of five stars,"As I've stated in a previous rating I would really like to see a finger print/passcode option to get into the app. Also I would like to see a feature that can recognize and suggest to delete duplicate photos. Other than that and the data sharing issues that I dont know where to begin with, I love this app lol blessings and respect to you all and thanks for doing your thing.",
5-Jan-24,Rated 3 stars out of five stars,Google photos has great features like saving pics allowing them to be backed up and organized into folders and yes the collages are pretty cool. But i don't like that pictures i have in folders you can still see in the photo section. Also the collage feature isn't that great anymore once i realized i can't choose the pictures i want to be used for the collage i want or even just allow me to add a couple more. Google also will highlight a random picture but i can't choose the 1 i want to do it to,
5-Jan-24,Rated 4 stars out of five stars,"To be honest this app has it's good points and it's bad points. I love that all my photos are stored and backed up automatically for me so I don't have to worry about losing them, but some of the features are hard to use and a little confusing to me. For example, when I am trying to share my photos with someone else and I try to seen them via text it wants them to sign in or something and I still haven't figured out how to use the sharing thing on the app. If it was a little more user friendly for those of us that aren't as tech and computer savvy it would be a great app.",
5-Jan-24,Rated 5 stars out of five stars,"Very good app for storing pictures and videos. It is also a great help during travels where you and your friends can create a shared album and just share all your pictures together so you can post real time if you want. Plus upon downloading the app, I found old photos here because I didn't know I still have back up of pictures I had from my previous phones. It also has that feature that creates stylized edit on your pictures and creates animations for consecutive shots. Overall, great app!",
5-Jan-24,Rated 1 stars out of five stars,"There is a button called ""free up space"" it should say ""free up space on your phone"" and explain what is about to happen. If you press it, all of the photos and videos on your phone are deleted and uploaded to the cloud. Great until you realise they're all at a low resolution. My videos are now useless. Thanks Google. I've lost hours and hours of footage for a project. Furthermore it dissolved the folders that I'd spent hours arranging.",
5-Jan-24,Rated 1 stars out of five stars,"I HATE this new version! I now have multiple folders with he same name. Before the update all photos showed in a single folder, i could still search by folder, but newly saved pictures were at the top of the list REGARDLESS of the source, e.g. screen shot, camera picture, saved from a text... The app is TOO helpful and complicates a simple process!!!",
5-Jan-24,Rated 3 stars out of five stars,"While using shared albums, we cannot use photos added by another user to make collages or animations or even upload on Zoomin for prints. What's the point of sharing the album then? Also while adding photos to Instagram, I can only see photos from WhatsApp and Camera, not Albums. No options of hiding photos in albums, everything shows up on main page. Also after a while old photos keep getting deleted from Albums.",
5-Jan-24,Rated 4 stars out of five stars,"The app does as promised and has some nice features, like creating sharable memories/stories. The major draw backs for me are some of it's major features like cleaning up storage on you device, it will not do as it says and only remove older photos it takes photos from all times and even from hidden collections üëÄ. This sucks combined with the fact that you can't share pictures from Photos to text or other apps like you normally would, you have to share via a link to the images.",
5-Jan-24,Rated 4 stars out of five stars,"still missing the old layout from 2018. it was perfect the way it was. either way, Google photos is superior. wish we had the option to use the classic version because it was üíØ",
5-Jan-24,Rated 1 stars out of five stars,"This is the worst photo app. I have had nothing but problems with this app Cons: You can only download one photo at a time to your phone. So if you are switching phones or trying to access photos from your cloud to upload for other things, you can only do it one photo at a time. I wasted 10 minutes trying to figure it out only to learn that this basic feature was ignored. What's up google? Google Home integration with photos was a nightmare too. Samsung wins.",
5-Jan-24,Rated 3 stars out of five stars,Pretty good for organising photos but not much else. The creation features are utterly useless. if you make a movie there's absolutely no way to actually save and share the finished video file. tried a million ways and it seems there's no fix to it. People have been having the same issue for years and nothing is done. Google doesn't really seem to care about user feedback at all.,
5-Jan-24,Rated 5 stars out of five stars,"I absolutely love the fact that I can easily backup everything on Google Photos. It's literally a godsend. I can't believe people pay for icloud storage when this is a free option. The functionality is super simple, though i would say people with slower connections might struggle to upload videos sometimes. I've convinced all my colleagues and family to use this for their storage and so far I've had no complaints. I also sometimes like the automated edits and animations in the For You section.",
5-Jan-24,Rated 2 stars out of five stars,"Deleting anything on here deletes it in your gallery too and once it's synced you can't easily unsync it. (the warning message did not specify that, it only said it would delete across google platforms) and when I tried to restore everything it said I didn't have enough storage?? So I signed up for the free trial to get enough storage to get my photos back and delete the app, but even after that it was beyond complicated to find the cancel plan button.",
5-Jan-24,Rated 5 stars out of five stars,Thank you very much to Google Photos!!!!!!! Problems Solved/Amazing Features: 1. Easy moving of pictures to other folders. 2. More convenient to organize pictures on phone gallery. Detects/recognizes local pictures and folders. 3. Easy to select pictures 4. Can select multiple pictures conveniently via hold then swipe 5. Quick loading of thumbnails 6. Works without WiFi 7. Helpful Assistant 8. Auto-creator of movie/animations 9. Automatic backup to cloud 10. All FREE!!! 11. & many more!,
5-Jan-24,Rated 5 stars out of five stars,This is a great app. The photos you take with your phone sincronize almost immediately with the cloud and are available for viewing in your computer right away. My favorite feature is the face recognition one. It will display a face and ask you to name it...once you assign a name to it you can type that name and will filter all the pictures in which that person is....including the ones you may have taken decades with an actual camera and that you uploaded at some point into the gloogle's cloud,
5-Jan-24,Rated 5 stars out of five stars,"I just don't know what I would do without my Google photos app!!! I absolutely love it. The storage is unbelievable. I'm always going overboard and taking a ton of pictures so the assistant is very helpful by putting together collages, animation clips, and movies which you can also do yourself plus a ton more awesome features. l've been using this app for four years hope you enjoy as well as I do!!! Thank you Google üòä",
5-Jan-24,Rated 5 stars out of five stars,One of the best app there for android photos and videos. It reminds us of the memories that we had on the same day earlier. It styles and makes collages of our images automatically and upto the perfection. Even the editing options that comes with google is plain awsome. I enjoy using all the features that it has to offer. Face recognition and grouping of pictures is amazing. Love that you can easily add photos to multiple albums.,
5-Jan-24,Rated 3 stars out of five stars,"The app was good for a while. But the loss of a key feature has made it difficult to enjoy using. We could once select which album(s) on our phone we wanted to back up to photos, now everything is automatically uploaded and saved under ""Camera"" with pictures/vids you DIDN'T want saved now saved and its frustrating. Cause if you send them to trash it will delete them from your phone. I sent feedback about it and never got a reply. That one feature loss screwed this app up for me.",
5-Jan-24,Rated 2 stars out of five stars,"If you like the way this thing works you'll love it, if you want to be able to do things like delete, rearrange, move folders quickly, change order, do anything you should be able to do with an included gallery app you won't. Layout is garbage, the background is stark white, there is a trash folder that makes it so your old JB gallery won't even delete photos properly so you are forced to use this Google garbage. Either let me uninstall this, or let me customize it like I used to be able to.",
5-Jan-24,Rated 3 stars out of five stars,"It's okay. Good enough to get me to use it instead of the built-in gallery app, but lacks: 1) Lots of useful features I see elsewhere, including downloading any photo! Mostly I have to share to email, send them to myself and THEN download, that's a joke! 2) Face recognition is limited and infruiating. Only around 50% accurate for me, often limits my manual editing capabilities. Doesn't pick up on enough faces for me to use it reliably.",
5-Jan-24,Rated 3 stars out of five stars,"The service is great. The app needs work. Photo editor is absolute garbage. Filters are worthless. Needs histogram, needs HSL sliders. Google owns Snapseed, why are those tools not integrated into Photos? At least the basics. Albums page is designed for children. I need to be able to zoom way out and get an overview of my albums and sort them differently, view folders on device and know if single photos are backed up or not, and need to be able to pinch and zoom in and way out within albums.",
5-Jan-24,Rated 2 stars out of five stars,"Since the previous updates the landscape photos are not displayed in full screen anymore but with the black panels/edges on the side which ruins everything especially if you have a big screen and you'd like to see the pictures in a full screen mode. P.S. same in the portrait mode, doesn't show the photos in full screen anymore. Please try to fix thia issue. Thank you.",
5-Jan-24,Rated 1 stars out of five stars,"Stop trying to force me to update. The full screen prompt is extremely annoying, and there is no point in updating a mere gallery.",
5-Jan-24,Rated 2 stars out of five stars,"sharing photos to upload to Google photos is too slow. even if 90percent completed and network changed ,you have to start over from beginning. if screen locls for a duration again uploadcfails",
5-Jan-24,Rated 3 stars out of five stars,"My complaint, which seems significant, is that menu options come up when I click on the camera, thus I have missed shots entirely when it was a time-sensitive photo opportunity. While one knows this is technically a useful feature, it felt like a camera malfunction. Simply, in some moments, I thus missed good shots: would it not be better to find a clever way to persuasively invite customers to take a moment to learn about/customize features? Maybe I missed that?",
5-Jan-24,Rated 4 stars out of five stars,"Best photo app out there. unlimited storage it has been with me through dozens of phones. i LOVE the search feature (family member names, objects its like a google search but for your own photos.) only down side is how long the ""fix lighting"" feature takes. many times i have to force close the app because its frozen trying to fix the lighting.",
5-Jan-24,Rated 1 stars out of five stars,"I've had this app for about 7 years already and it used to be really good about syncing like as soon as you would take a photo, screenshot, or something else but it would sync up the pictures ASAP and now I have to go into the app every 2 weeks so all of my pictures can back up all the way and I hate that so much. I think you guys should fix please. Thank you very much",
5-Jan-24,Rated 1 stars out of five stars,I can't disable video autoplay when looking through my photos. The motion makes it hard for me to see as it will for others with visual impairments. I just want to view static photos but there's no option to disable. Definitely a step backwards. It also adds buttons at the top with feature photos but these can be removed thank goodness.,
5-Jan-24,Rated 5 stars out of five stars,"I absolutely love this app. I've had installed for many years, have over 17000 photos not including the archive! I've never had any problems or issues with the application or storage and of course everything transfers automatically with login on new phones. No picture/video loss worry's is a wonderful security feature included as well. I also ge personalized suggestions on photo books, collages along with a variety of other features Of which, can be controlled within the notification settings",
5-Jan-24,Rated 1 stars out of five stars,"Uploading into an album and being able to share that album -a simple task, mind you- is super large, buggy, and just plain defective. This was true on my Android end, and on someone's iPhone. I was so turned off by the pending ""1 item left"" and ""cannot share album, try again later"" after attempting all day that this will be the end of my time with Google Photos. Sad, because the recognition and organizing features of Google Photos are great. Now put some of that inguinuity into functionality!",
5-Jan-24,Rated 4 stars out of five stars,"I love this photo app and use it every day but I feel there could be some features added to it to make it even better. First I wish there was a way to add a person to the photo without the app recognizing that it's someone. I find it happens a lot, it might be a side pic and it doesn't know it's me. Also tags would be a great feature. Like the people tag but you can create them, like ""Cars"", ""Tattoos"", ""Food"" for example. I feel it would make finding photos easier if you can group them yourself.",
5-Jan-24,Rated 1 stars out of five stars,"Everything is good... But only one thing which I don't like is its video playing feature. For Exp. If I am watching any video in this gallery and I have to go back due to some reason then it dosen't ask me for resume playing, it only resumes if I am directly out from gallery. There is no support for resume playing a video if I click a back button. üëé",
5-Jan-24,Rated 5 stars out of five stars,"Great app for media management and backup. Recent integration with assistant helps keep clutter under control and ""rediscover this day"" features constantly delivers pleasant memories. I also like that there's an option to make unlimited backups for people who can't afford buying extra storage or those who doesn't need media in the original resolution and are happy with just ""good enough"" quality.",
5-Jan-24,Rated 4 stars out of five stars,"Overall Good, need select all option, feature",
5-Jan-24,Rated 3 stars out of five stars,"Everything seems to be going downhill since i moved to pixel 4xl. This app behaviour has changed for the worse and old features like things assistant created for me are nowhere to be found. And overall performance of the phone is junk. Glitchy, Bluetooth issues. Probably going to return it. Too bad, I thought the pixel 2 was great.",
5-Jan-24,Rated 2 stars out of five stars,"The app is OK but needs a lot of improving. First of all, the videos are not labled with text which isn't detectble for screen readers which is the same on the website. This is particularly glaring since you took away google photos access from google drive, i used to record programs on catchup sites and save them on google photos, so doing away with the google drive access and the problem above means it is pointless. Using the movie editor is problematic as well since you are forced to use music, but the app is slow also which slows you down as well. The backup and cynce feature is another problem. It is quick to snatch a photo or video that has arived in a folder that you wanted to backup, but it doesn't give you a chanve to rename the file and if you did rename the file while in the backup process, the original name is kept.",
5-Jan-24,Rated 1 stars out of five stars,"Work on the memories, and the app layout. As for the editing tools... You have to free up some of these things.",
5-Jan-24,Rated 4 stars out of five stars,"I want to specify the storage place for downloaded photos. Like when I download photos from Instagram, it's automatically create a new folder called Instagram. And screen shot are stored separately. I would prefer I can choose to have only one folder for all them. I can only edit the time in the camera folder, but I can move every photos to that folder, it doesn't make sense to me. It would be helpful if it store the time of the photo created, instead of the time I downloaded it.",
5-Jan-24,Rated 5 stars out of five stars,It's very useful and many of features to protect our images but no any editing features I requesting you to provide some editing features,
5-Jan-24,Rated 1 stars out of five stars,"Unstable and does not value user's time invest. When selecting pictures to add to shared album, the app frequently crashes with no error message. Then you have to start over again, even when the selection of hundreds of photos is lost. Please please please add a feather that saves the pictures you have highlighted so you don't have to sort your photos several times!!!!",
5-Jan-24,Rated 5 stars out of five stars,"Extremely helpful and reliable. When my kids fill my phone up with pics and videos, periodically my Google photos app lets me know that it's all backed up & gives me the option to free up X amount of gigs.. (today it was 19 gigs).. All I had to do was hit a button. Also, I never have to worry about losing my pics or videos & easy to print from the app or anywhere else.",
5-Jan-24,Rated 3 stars out of five stars,"I used to love everything about this app, but over time issues just grow. Sometimes moving photos from one album to another causes them to dump at the top, instead of ordered chronologically. Wish there was a way to change the dates of multiple photos at once because of this issue. Sometimes when I crop a photo, the action loads indefinitely and I have to exit the app. It does have a lot of good features - the editing software is great and the search option is impressive.",
5-Jan-24,Rated 3 stars out of five stars,"It's okay, the features like Animations are cool but slow, it's annoying to create and sort albums and folders. For some reason I can't create any new folders like I want but can only make albums. My phone won't sort and show albums, only folders when I'm looking through files. It would be helpful if it would let me make my own folders. It's all just meh.",
