date,rating,comment,Category,Sub-Level,
12-May-24,Rated 5 stars out of five stars,"""Google Translate is a lifesaver when it comes to breaking language barriers. Its accuracy and vast language database make it an essential tool for communication, whether traveling abroad or interacting with people from different linguistic backgrounds. The ability to translate text, speech, and even images in real-time is truly remarkable. While not perfect, it's continuously improving, and its convenience is unmatched. Highly recommended for anyone navigating a multilingual world.""",Uncategorized,Features & UI,
12-May-24,Rated 5 stars out of five stars,"‚ò?3/18/24 ""Google Translate is a lifesaver when it comes to breaking language barriers. Its accuracy and vast language database make it an essential tool for communication, whether traveling abroad or interacting with people from different linguistic backgrounds. The ability to translate text, speech, and even images in real-time is truly remarkable. While not perfect, it's continuously improving, and its convenience is unmatched. Highly recommended for anyone navigating a multilingual world.""",Uncategorized,Features & UI,
12-May-24,Rated 1 stars out of five stars,"The ability to take a picture of translated text is gone, even though the UI tells me that's what the white button is for. I get options like ""share"", ""listen"" and ""select all"", but no option to just take a picture. This is inside the ""camera"" UI. I'm just taking screenshots at the moment which has all the UI on too. A really bad change.",Uncategorized,Features & UI,
12-May-24,Rated 1 stars out of five stars,"Hey Google translate You don't know this but I can tell you that when you see this translate text on a black screen like this, naturally a human will not be able to understand anything accurately and it will be a big problem for your customers to understand things quickly and it will be a good experience if you get it right , I mean seeing blues like this on a black screen can be eye straining and it would be great to change that . Hope this gets fixed thank you",Uncategorized,Features & UI,
12-May-24,Rated 4 stars out of five stars,"I would rather give this app 4.5 stars, but the option is not made available to me. It would be 5 stars if it could allow one to distinguish between formal and casual tense for Latin languages, and could account for certain dialects and idioms. I tried translating something and you changed the word for refrigerator three times. If I hadn't looked it up, I wouldn't have known that they were three different regional or dialectical words meaning the same thing. That is not helpful.",Uncategorized,Features & UI,
12-May-24,Rated 4 stars out of five stars,"Pretty good translator, sometimes a little formal, but generally I'm understood. I'm told that the formal translation can be a little harsh to native speakers, meaning less colloquial",Uncategorized,Features & UI,
12-May-24,Rated 5 stars out of five stars,"It is best for translation only one PROBLEM PLS PUT IT ON ON SCREEN SO THAT I CAN TRANSLATE FROM ANY APP, I have to open app and select image to translate",Uncategorized,Features & UI,
12-May-24,Rated 1 stars out of five stars,"Sadly after many years of usage I've finally had to give up and uninstall it. Not even talking here about UI getting worse and worse with each version. At this point it can't reliably perform its main task - simply translate things. No matter whether you have offline dictionaries or not, internet connection on or off - it just keeps showing message: ""Can't translate. Check your connection and try again"". Fortunately there are still solid alternatives out there.",Uncategorized,Features & UI,
12-May-24,Rated 4 stars out of five stars,"Good, but feels like a beta version of the potential. Quite a few bad design choices. One terrible design that makes zero sense is that if you input a text you want to edit you can only do that while viewing one single like at a time. So you try to edit and suddenly can only see 7 words at a time while the rest of the screen goes white. Really makes it unusable for more than 7 words at a time. But it's great for single words.",Uncategorized,Features & UI,
12-May-24,Rated 1 stars out of five stars,"Beside disputable changes in UI, it doesn't work any more for me. Sony Xperia XZ1 here. For example in WhatsApp when I copy a text, the usual balloon doesn't appear any more. Via the contextual menu after a long press I can choose ""translate"" for it to appear but then I have to manually paste the text and press to translate. If I choose to show the floating icon in the settings, this is permanent and intrusive, and I have to still paste the text I manually copied in to get my translation.",Uncategorized,Features & UI,
12-May-24,Rated 1 stars out of five stars,"New photo to text UI is garbage, can't even open a phrase up in the main translate page without copying it in the scanning page",Uncategorized,Features & UI,
12-May-24,Rated 3 stars out of five stars,"Before updating the app, the tap to translate button would appear on the screen automatically whenever I copied any text, and it would disappear after closing the translation. It was very intuitive. But after updating the app, the tap to translate button always remains on the screen. Which is very annoying and non-intuitive. Please revert back to the previous way of showing tap to translate.",Uncategorized,Features & UI,
12-May-24,Rated 4 stars out of five stars,"Sure it helps me a lot and can work offline. There are many translations which are not quite right, but this is acceptable.",Uncategorized,Features & UI,
12-May-24,Rated 4 stars out of five stars,"4 stars instead of 5 for the original version... Although I hate the new interface that keeps my history of translations hidden from my 'immediate' access, without a doubt, Google Translate is still a valuable asset for my purposes. If Google ever started advertising in the app I would dump it in a nanosecond. OK Googs, don't ruin what still remains a good thing.",Uncategorized,Features & UI,
12-May-24,Rated 1 stars out of five stars,"What is happening with tap to translate on Android 10? üôÑ Edit: problem with tap to translate, on previous version of Android it worked just fine, I would copy text, there would be pop up for translating. Now I have to keep pop up icon on display all the time, if remove it from screen, it won't work and you have to admit that is very annoying. Premission for notications are given.",Uncategorized,Features & UI,
12-May-24,Rated 2 stars out of five stars,"I have chosen to pronounce in American accent from the region section, and after all the voice turns into British accent all of a sudden, I've tried to clear all data and then start all over again and when I type a word and listen to the voice, it's American accent but when I close the app and open it again, it returns to British in some words and American in other words. Please solve this problem.",Uncategorized,Features & UI,
12-May-24,Rated 4 stars out of five stars,"Everything is super awesome !! But I got one problem, it is totally impossible to change the accent of it. It has British accent but when I choose in the setting section of ""region "" the United States nothing happens. Please guide us to correct this problem.",Uncategorized,Features & UI,
12-May-24,Rated 1 stars out of five stars,"The problem persists with the latest version. Google developers are rubbish it seems. I can't translate screenshots or pictures saved on my phone. The buttons that are supposed to be on the bottom of the screen within the app, don't appear. Reinstalling didn't help. Using Bing Translator instead.",Uncategorized,Features & UI,
12-May-24,Rated 1 stars out of five stars,"Absolutely terrible! Reverse translate button - lost. Now you can only switch languages, not the phrases. üëéüëéüèªüëéüèºüëéüèΩüëéüèæüëéüèø Switch languages button accessible only after a click in the text field. History, while comprehensive, is not at all accessible while typing, i.e. requires two un-intuitive clicks while it could easily be reached by scrolling down.",Uncategorized,Features & UI,
12-May-24,Rated 1 stars out of five stars,"Floating translate doesnt work. Font size is ginormous and cannot be changed. This is a phone app, people. Limited screen space. Conversation mode does not work. It returns nothing. It could be a very good app but instead it was ruined in 2/22 and apparently cannot be fixed. Where there is a will there is a way. Must be lacking in will.",Uncategorized,Features & UI,
12-May-24,Rated 1 stars out of five stars,"Earlier, if I copied something, Tap Button would come, and that was very good, but now Tap Button is always seen on mobile skin, which is a nuisance. I want it to be the same as before, if you copy something you will see the tap button and when you translate it will go away ,,,,, you always see the tap button it is annoying and if you copy something you do not see the tap button. I want as soon as possible fixed this problem.",Uncategorized,Features & UI,
12-May-24,Rated 1 stars out of five stars,"Tap to translate doesn't work properly on android 10 on my galaxy note 10+ I gave the permission frome my note to the translation app and i did enabled the tap on translate The problem is : When i opened for example the Facebook, the floating notification stays on the side of the screen and when i try to hide it goes forever untill i reactivate it So the floating icon or stays forever or hidden forever When i had note 9 it does show only when i make copy for a text and disappears aftr 2second",Uncategorized,Features & UI,
12-May-24,Rated 1 stars out of five stars,"The new UI is horrible. Unnecessary (and stupid) changes. Reverse translate is uncomfortable to spot, and the ""spelling"" is mostly gone. Very obvious that whoever approved the changes doesn't speak more than her/his own language.",Uncategorized,Features & UI,
12-May-24,Rated 1 stars out of five stars,"Google. If you were going to put this un-intuitive skin or interface, at least give us option for keeping the old way. The old one was fine - kept the history on the same page, text size was just right. The new interface makes me want to uninstall this app.",Uncategorized,Features & UI,
12-May-24,Rated 2 stars out of five stars,"Detection from camera/images is completely unusable. Does not recognize characters, even from a screenshot of basic web fonts. Fresh install, so definitely a problem with this version/app. Surprisingly, Microsoft Translate works infinitely better.",Uncategorized,Features & UI,
12-May-24,Rated 1 stars out of five stars,"Mediocre translation app, completely ruined by the giant blank space below its single line of search bar. Since I often translate entire sentences or paragraphs, I find it infuriating to have to continually scroll through my text line by line, instead of being able to see it in its entirety on the aforementioned blank screen.",Uncategorized,Features & UI,
12-May-24,Rated 5 stars out of five stars,"This is the best translator I know. To expand the translator's capabilities, it would be necessary to do: 1. The ability to edit the source text and the translation. 2. The ability to see the text on the screen during a phone conversation (for people with hearing problems).",Uncategorized,Features & UI,
12-May-24,Rated 1 stars out of five stars,"Material You is the worst thing that could've happened to Android, this new redesign is horribly unintuitive, unaesthetic and unnecessary. AND BEFORE YOU COPY AND PASTE YOUR PRE-MADE ANSWER AGAIN; NO THERE ISN'T A THREE-LINE MENU ANYMORE! IT'S BAFFLING HOW A MULTI-BILLION DOLLAR COMPANY IS SO BAD AT BASIC THINGS.",Uncategorized,Features & UI,
12-May-24,Rated 3 stars out of five stars,"Downloading the offline packages for Spanish wont work. When I click the downlaod button on my Sony XPERIA XA1 Ultra, the circle keeps spinning and never stops. It never downloads. Ive tried multiple things to try and fix this problem but it just wont download! Please help, translating offline is really helpful.",Uncategorized,Features & UI,
12-May-24,Rated 1 stars out of five stars,"I want the old design back. The new one is so inconvenient. It doesn't display the way to read the Japanese translation(romanji). Also, there is no button to quickly switch between Japanese to English and English to Japanese.",Uncategorized,Features & UI,
12-May-24,Rated 1 stars out of five stars,If we are talking on WhatsApp So sometimes it stops working Sometimes it doesn't even translate please fix it Popup window Keep the voice translate option inside Sometimes talking on WhatsApp requires voice translation But this time the option does not return So we have to open the application and translate it back And there is an option in which a message can be sent immediately after translating. It takes a lot of time to copy and paste. thanku good bye.,Uncategorized,Features & UI,
12-May-24,Rated 1 stars out of five stars,"Tap to translate only works now in floating mode. It requires extra steps now and half the time, it still doesn't work. I'd gladly pay to have it the way it was before. It's going to increase my study time by quite a bit. I agree with the other comments about using the whole screen.",Uncategorized,Features & UI,
12-May-24,Rated 3 stars out of five stars,"New design is not very intuitive, doesn't automatically switch keyboards like before and transcribe button/function has gone?! I'm all for modernising but the app as it was before worked well for me.",Uncategorized,Features & UI,
12-May-24,Rated 1 stars out of five stars,"Was the best translating app before, now they changed the UI and now its bulky and horrible. I cant easily switch the languages im typing. I have to hit the back button. Worst design flaw of all time honestly. Ill look for a different app if there is one",Uncategorized,Features & UI,
12-May-24,Rated 1 stars out of five stars,you guys have got a very serious problem with one of your created translator that will haunt my phone until the day you fix it or when my phone shuts down. I cannot get rid of it and everytime i go to another page it translates it to another language when I dont want it but it to but it does it anyway. If you can fix this problem then that will be the greatest improvement you will ever make with one of your translators.,Uncategorized,Features & UI,
12-May-24,Rated 5 stars out of five stars,I accept this as a way to communication with languages that have been served as the most common form of speaking languages were quite known as the words to pronounce correct pronounce for the first approached as well as speaking native languages that were usages Supporting sounds that closed to today translation of exactly sounding liked eavesdrop on sounds like exactly the way original characters that were meant to be acceptable. Thank for sending the programmer of Google translation to server.,Uncategorized,Features & UI,
12-May-24,Rated 3 stars out of five stars,"Is it only my problem, when I translate some text and than trying to make some corrections, I see only two strings of my text? Why I can't see whole text block during the corrections? The rest of the screen is empty.",Uncategorized,Features & UI,
12-May-24,Rated 5 stars out of five stars,In the past i could share with whatsapp n email n a lot of others. Now i cant. Why this change. Also the icon appearing all the time on the screen n if i hide it i cant translate directly. I hope u change these two things back to what it was. I also hope u would include hebrew in the voice setting. This is a great app except for these three problems. Please do something about them. I am giving 5 stars anyway.,Uncategorized,Features & UI,
12-May-24,Rated 1 stars out of five stars,"How did you screw this up? I loved this app, especially the tap to translate. My wife's family is Colombian, so lots of Spanish in our texts. I could simply long press the text, copy, the button would pop up, tap it, and bam! Translated. Then the icon went away until I copied something. Now you want to keep the icon on my screen the whole time? And a drop down menu entry? You guys went stupid. EDIT: I don't care why you ruined it.",Uncategorized,Features & UI,
12-May-24,Rated 3 stars out of five stars,"Offline transactions are often off (give you the least suitable translation). For example, it translates ""veneer"" as ""–ª–∏–º–∞–Ω"" to Ukrainian in offline mode (which is not the most common translation of the word). But it translates it as ""—à–ø–æ–Ω"" in online mode (correct translation). P.S. Google, stop paying Indians for 5-star reviews, lol)",Uncategorized,Features & UI,
12-May-24,Rated 3 stars out of five stars,"I do not like the new interface. The old interface was more intuitive. Kindly ask the development team to concentrate on functional improvements, not UI dress-up.",Uncategorized,Features & UI,
12-May-24,Rated 5 stars out of five stars,"First off, Google alone is just great. I work for an international company. Sometimes we get guest from other countries. Using this app was able to make the guest feel comfortable knowing a break down in translation wouldn't be a problem during their stay. Long story short the review received from that guest gained me many accolades from my company. Thank YOU GOOGLE!!!!!!!",Uncategorized,Features & UI,
12-May-24,Rated 1 stars out of five stars,Didn't work at all. Couldn't even record a voice. Pushed the microphone button and it just kept quickly turning off and telling me to push the microphone button again. I'm embarrassed for Google for making an app this bad.,Uncategorized,Features & UI,
12-May-24,Rated 4 stars out of five stars,"I have starred/saved probably over 3000 translated phrases and this is why the mobile and web app have huge problems displaying them correctly. It seems like they aren't synced properly and when I refresh the starred/saved tab, it always finds new saved translations. Please fix this!",Uncategorized,Features & UI,
12-May-24,Rated 1 stars out of five stars,Please do not direct me to the incorrect suggestion webpage. Everyone will know there is no problem to copy and paste the words inside the Google Translate Android App. The problem is the new version Google Translate App for Android 10 does not work directly on any .pdf files after you even just marked 1 word you want to translate. The Google Translate works well on Android 9 whenever you mark the any words directly on .pdf files. Please fix your Google Translate App for Android.,Uncategorized,Features & UI,
12-May-24,Rated 2 stars out of five stars,"Why does the Google translate UI only occupy 1 cm on the top of the screen when one is typing the messages to be translated? Even if the translation is in real time, it's impossible to read the super long 1 liner translated text while still composing the messages. Is this intentional?",Uncategorized,Features & UI,
12-May-24,Rated 3 stars out of five stars,"Simply incredible speech engine. Atrocious UI interface. This app performs the same function in different ways, with different outcomes depending on which page you start from.",Uncategorized,Features & UI,
12-May-24,Rated 5 stars out of five stars,"This is an excellent app.But recently I felt a problem. when I translate English to Bengali By voice,then it says ""Tap and hold the Google assistant button"" but after that it don‚Äôt start translate my voice.I think this is not the apps problem. but how can I relief from this problem.",Uncategorized,Features & UI,
12-May-24,Rated 1 stars out of five stars,no more offline translation support? your support team send me this - ( Open app - Menu - Offline Translation. Ensure both the languages are listed under ‚ÄúDownloaded Languages‚Ä? Try enabling ‚ÄúAirplane Mode‚Ä?from phone Settings to be completely offline. Hope that helps. ) I am unable to find this option please guide me !,Uncategorized,Features & UI,
12-May-24,Rated 1 stars out of five stars,"The app stopped working a few days ago. It shows pink screen and says: ""can't translate. connect to the Internet or try again later "". But my Internet works fine. Tried to redownload it but the app still doesn't work . Could you help me with this problem ,please ?",Uncategorized,Features & UI,
12-May-24,Rated 2 stars out of five stars,Latest update to the UI is frustrating and clunky to use. Have been trying to adapt but there is simply too much on the screen at all times trying to translate a piece of text from an image. Previous UI design was intiuative and easy to understand. I've resulted in using the desktop version over the app because of how useless it is.,Usability,Features & UI,
12-May-24,Rated 1 stars out of five stars,"The new update completely ruined it. Before, the real time conversation worked excellent. Now, it hardly ever works, and it won't immediately speak the results. I have to push a button to get it to speak (if it will even pick it up), even though I've checked in my settings and I have it set to ""immediately speak results"". Please change it back!!",Usability,Features & UI,
12-May-24,Rated 1 stars out of five stars,"New version is terrible. Takes three taps to translate now instead of one. How is that an improvement.... Update Installed: 25/2/22 - still terrible. Clearly the developers care about user feedback.....not. 12/08/22 well done you made it even worse. Tap to translate doesn't work at all now. 29/04/24 - Now multiple ttt circles are on my screen. I have to reboot to reduce to 1, but they build up again in a few hours.",Usability,Features & UI,
12-May-24,Rated 5 stars out of five stars,"Perfect for having conversations and making friends with people who I once would have never even met online. But the only 2 problems are 1)the lack of a chat app function and 2)because of this, any conversation in an app with end to end encryption requires the support of an app such as Google Lens along with screenshots of the conversation.",Usability,Features & UI,
12-May-24,Rated 1 stars out of five stars,The app doesn't switch between the language of the keyboard since the latest Android update. Gets stuck and you have to close the app and open it again. So the switch button is useless most of the time. I don't know what that reply is supposed to fix since it has NOTHING to do with the described problem,Usability,Features & UI,
12-May-24,Rated 5 stars out of five stars,This app is the ultimate best! Not to mention it's free for the world to use & access! Any person with a phone can explore the world through language and even down to dialects! This is a modern marvel the power and such precision man this is a technological wonder! Yet there's still some genius wanna be complaining about not being able to distinguish some casual & formal tense IN LATIN DIALECTS so he could only spare 4 stars! Man thats what you call a PUTRIDUM PODEX! Ppol nowadays so ungrateful,Usability,Features & UI,
12-May-24,Rated 1 stars out of five stars,"New interface blows. Why change up the way its been for years? It feels infinitely more difficult to navigate and read than the old version did, so your garbage attempt to make all sleek and modern ruined its intended use.",Usability,Features & UI,
12-May-24,Rated 2 stars out of five stars,"Actually the big problem to me was this floating icon. Once you drop it into the crossed circle at the bottom of the screen, the floating icon toggle switches back off in the settings. It didn't use to be that way, it's a big mistake making it working this way. Please revert it to the way it worked before. Dropping the floating icon into the crossed circle doesn't mean I am not gonna use it anymore... I will but maybe later. It's a bit of a hassle to go to settings to turn it back on. TY!",Usability,Features & UI,
12-May-24,Rated 3 stars out of five stars,"I've been using the app for about 6 years. Works great mostly. But I have to keep downloading and older APK because the newer interface, material u, doesn't work the same. When communicating with family overseas, it's easy to copy the message I want to translate, hit the floating bubble, read what they said, hit new translation and the app automatically switches between the languages and I can start typing my response quickly. The material u interface is a lot more work.",Usability,Features & UI,
12-May-24,Rated 3 stars out of five stars,"Translation requires on the fly proof reading -- that's ok, except that the interface is incomprehensibly awful. Two cramped lines of text for each language stuck at the very top, with tons of blank real estate right below? If i want to translate two sentences and go back to edit a typo, it means trying to scroll that tiny space and drop a cursor. And accepting the ""do you mean"" kicks you out the text and into the copy, so can only be used at the end. The iOS version is much, much better.",Usability,Features & UI,
12-May-24,Rated 4 stars out of five stars,"I have enjoyed using this app for quite some time and have found it to be extremely useful. I can either speak or type into my phone (in app) in English and at the touch of a button, my words are instantly translated into Spanish, viewed in text and also played in audio. My Spanish language skills have greatly improved. This app offers several other languages, as well. However, I deducted one star in my rating due to a mystery HACKER typing a message related to my text. Scary. I alerted Google.",Usability,Features & UI,
