date,rating,comment,Category,Sub-Level,
12-May-24,Rated 5 stars out of five stars,"I am absolutely blown away by the Google Translate app! As someone who frequently travels to foreign countries, this app has been a lifesaver. The accuracy of the translations is incredible, and it even has a feature where you can hold your phone up to text and it will instantly translate it for you. I've used it to communicate with locals, read menus, and navigate my way around unfamiliar cities. It's truly a game-changer for anyone who loves to travel or communicate with people from different",Feature Requests,Features & UI,
12-May-24,Rated 2 stars out of five stars,"Recently got a new phone running Android 10 and I really dislike how the new ""tap to translate"" button works now. Before, it would conveniently only appear for a few seconds when you copied some text. Now it's always there and gets in the way... It was something I used daily before and was a great feature. It's useless now unless you want to have it on your screen at all times...",Feature Requests,Features & UI,
12-May-24,Rated 4 stars out of five stars,"This app is more of an app you use if you can't get to your PC. Not the same functionality at all. Only unformatted ASCI plain text signature, can't make new labels, can't do complex searches, etc. Good for emergency review and response only, don't rely on it for any of the things you might actually want to do on the go. Looking forward to more features and fuller functionality. Been with Android since G1.",Feature Requests,Features & UI,
12-May-24,Rated 1 stars out of five stars,"Since the update the UI is f'ed up. Can't (reverse) sort history by date. Extra buttonpush needed to see history. Why not leave well enough alone? Or at least have thw option to revert to the previous version / interface. Not nice, folks. Now I will have to look for a different app that works as well and does what I want.",Feature Requests,Features & UI,
12-May-24,Rated 1 stars out of five stars,"The new UI is functionally terrible. Used to be able to copy pinyin from English <-> Chinese translation, not anymore. Used to be able to see translation history immediately, now need to click on entry mode before an icon shows up to be clickable to show translation history list. It seems rolling back the UI update would be a winning formula here. No update is better then functionally deteriorating updates, even if it looks like beauty contest winner.",Feature Requests,Features & UI,
12-May-24,Rated 4 stars out of five stars,It really is a good app. Translations are back far the best when it comes to machine translation and also has a good interface. But it would really be handy if a feature to directly translate from screen is added as situations where you can't copy texts occur often and we need to take screenshot then translate it or type the whole text in a language we don't any clue.,Feature Requests,Features & UI,
12-May-24,Rated 2 stars out of five stars,"Its previos version is very cool and helpful. In previos version there is feature in which whenever we copy the POPUP is visible and we can find tranlation, but in new version there is lack of these feature. Instead its has always showing popup so it is notmuch cool and also it comes in between screen. So I suggest to Bring that feature back.",Feature Requests,Features & UI,
12-May-24,Rated 2 stars out of five stars,"Really dislike the new ui. It is not intuitive to use, lacks helpful information visible from the main screen like recent translations, and does not appear to auto adjust my keyboard language like the old one. There should be an option to opt out of this redesign, it significantly reduced my productivity in the app.",Feature Requests,Features & UI,
12-May-24,Rated 1 stars out of five stars,The feature where user use to copy text and a popup appeared has disappeared. Now I always have to have annoying bubble around my screen or notifications bar. The feature should be introduced again. It's not easy to open notifications bar on NOTE 10+ because the screen is long and the annoying chat bubble can't be customised in regards to size or positioning.,Feature Requests,Features & UI,
12-May-24,Rated 1 stars out of five stars,"The new update is worst. I specially liked the tap to translate feature how it used to translate from chosen language. But now everytime i have to select the language in which it is written and the language in which I want to translate to. I liked the previous update before the UI and everything got changed. The UI is also bad, so large screen that it doesn't feel appealing at all.",Feature Requests,Features & UI,
12-May-24,Rated 3 stars out of five stars,"This used to be a really good app, as previous translations could easily be found and seen. Now it seems it has been updated, and All history has disappeared, and recent translations that might be needed again quickly have to be re_input,which is very inconvenient. I am sure things can be saved but there is no menu and no obvious way to do so.not happy",Feature Requests,Features & UI,
12-May-24,Rated 1 stars out of five stars,"Before update: üéô->üéô . After update: üéô-> ‚ú?->üéô. I use the microphone translate quite often. After updating the apps, I now have to clear the current translated text before I can click the microphone button again. This is so not used friendly. And it's time consuming. Second, the new transcript feature was cool. Please make it available for Japanese language.",Feature Requests,Features & UI,
12-May-24,Rated 1 stars out of five stars,"The new update makes this app unusable and awkward. Especially for Chinese, where the Chinese writing is massive for some reason (which is what I'm translating into English, so why would this need to be massive?). The pinyin is below and requires scrolling down for some reason and is tiny for some reason, and then English which is scrolled further down again. If it's possible please revert back to the old app. I also left feedback in the three dots section of the app.",Feature Requests,Features & UI,
12-May-24,Rated 5 stars out of five stars,"All the time the icon is visible. I just updated android OS 10 and all the time the icon is visible. With OS 9, It only appeared when I selected and copied the text. As I can do to make it turn on translation but do not see the icon on all screens without needing it. When I hide it, it indicates that it is necessary if I require to translate. I repeat before it was hidden and could translate without problems.",Feature Requests,Features & UI,
12-May-24,Rated 3 stars out of five stars,"Very helpful app. I have an advice that you should consider it as top priority for the next update. I can easily swap and change languages, but when I click on the content box the tab of changing languages disappear unless I have to go back. Please always keep the languages bar visible in all conditions. Again this is very serious problem and you are google. Biggest internet company in the world. I'm sure you can fix it. I don't mind even paying for the app. Thank you",Feature Requests,Features & UI,
12-May-24,Rated 2 stars out of five stars,"As per usual, Google has changed the UI out of nowhere and moved many useful features 3 extra clicks down a random menu. There's so much dead space now that used to have useful information and utilities. Why? If switching to a new design language makes things less functional or convenient, maybe reconsider what changes are made.",Feature Requests,Features & UI,
12-May-24,Rated 5 stars out of five stars,"Google Translate has a feature called Transcribe, which can transcribe speech from one language to another in real time. You can use it to follow along a lecture, a speech, a podcast, or a conversation in another language. You can also adjust the text size, theme, and speed of the transcription.Google Translate can translates text, speech, handwriting, and images in over 100 languages. You can use it to understand foreign texts, websites, signs, menus, and more. Thank You Google Translate‚ò∫Ô∏è‚ò∫Ô∏è‚ò∫Ô∏è.",Feature Requests,Features & UI,
12-May-24,Rated 3 stars out of five stars,"The quality of translation is very erratic. But also the UI of the app degraded significantly with recent updates -- history used to be visible but now needs two clicks to acces it, there was a button for reverting the translation direction but now it got pushed under a drop down menu.. Both of these were very useful functionalities.",Feature Requests,Features & UI,
12-May-24,Rated 5 stars out of five stars,"dear developer, could you make some adjustments for the english, I mean. . what if you make a difference between US and UK translation, especially for sound feature, maybe you can make a pop-up choice when users tap on sound button, so users can hear the right pronunciation from both languages based on what they choose. thanks :)",Feature Requests,Features & UI,
12-May-24,Rated 1 stars out of five stars,"That version is stupid. The icon should not always stay on my screen. The previous version was nice. Sometimes you should understand that not all versions need to be modified that way. Just update it to put something new. But no need to change everything to make it worse as if updating is a constant requirement. When a version is good, you have no need to modify it. It can stay for years.",Feature Requests,Features & UI,
12-May-24,Rated 5 stars out of five stars,"I am amazed from this app. Apart from written translatio it has the feature to vouce transatios from and to virtually all languages. It's dependable, easy to use and does everything plus and extra mike of user friendly interface and I use it regularly and highly recommend to the other users to consider taking the app which will make the translation in a few different ways easy enough for everyone regardless her/his computer knowledge",Feature Requests,Features & UI,
12-May-24,Rated 1 stars out of five stars,"This new design & interface doesn't even deserve a single star. The tap to translate has become even more hectic. It does translate what is copied however it does not switch the language when you press ""new translation"". A year or two ago it did that. It was pretty much game changing back then. Whichever brain was behind this new interface, needs to stop working on it. Must restore the year old version of this app or bring the old features back else I see this app going down.",Feature Requests,Features & UI,
12-May-24,Rated 1 stars out of five stars,They ruined the tap to translate feature with the latest update. You now have to paste the text into the app everytime you want something translated. The floating icon now always stays on your screen. In the old version it would only appear for a few seconds after you recently copied something. It no longer auto detects the language.,Feature Requests,Features & UI,
12-May-24,Rated 1 stars out of five stars,"Mainly used this for the tap to translate feature, but now the stupid bubble stays on screen all the time! Disabling this until it's fixed. I've read the link mentioned in your response (though you realise we can't tap that link from here? Thanks, memorising that URL was fun) I get the security concern, but let me grant permission for this app in that case? Ultimately I don't really care the reasons, it's made this app pointless, might as well just use it in Chrome",Feature Requests,Features & UI,
12-May-24,Rated 3 stars out of five stars,"Almost there, but still needs a little work on to be more intuitive. For example, rather than highlight the text by swiping the screen (for the camera function), why not default the translator function to interpret the entire source?",Feature Requests,Features & UI,
12-May-24,Rated 1 stars out of five stars,"Was a great app! The user interface allowed me to see the history, so I could jump back and forth so I could type in variants of previous searches without forgetting them. Also I could switch between translations back and forth easier. I already have forgotten a lot of gear features which existed, and it's so much worse..",Feature Requests,Features & UI,
12-May-24,Rated 1 stars out of five stars,"The tap to translate feature used to open a bubble icon upon copying a text for an instant translation and then disappear on its own. I loved the way it can instantly translate upon command. Now, this bubble just remains on your screen indefinitely until you manually hide it. After you hide it, it doesn't reappear until you unhide it from your settings. This makes the feature counterproductive and ultimately useless, as it's annoyingly unbearable. Please revert to the automatic hide/reappear !",Feature Requests,Features & UI,
12-May-24,Rated 1 stars out of five stars,"New update no longer shows previously translationed words easily, the purpose of a translation app is for convenience. Previously translated words should be quickly accessable. If I have to go to a different page to find my history (which doesn't include suggested translations) how is that more convenient than scrolling down. Writing system has always been terrible, if I want to write a kanji, after one stroke the app moves to the next word it's not suitable for multiple stroke writing systems",Feature Requests,Features & UI,
12-May-24,Rated 1 stars out of five stars,"The app was good, after the UI facelift, the Reverse language during translation is hidden to the top right menu button, which is more irritating than anything else, the whole point of using Google Translate is to be able to do it without interruption, anything useful hidden means angers and frustration. Who ever thought it was a good idea should resign from being a UX designer",Feature Requests,Features & UI,
12-May-24,Rated 1 stars out of five stars,"The app was superb until the recent update where they completely changed the UI, which now sucks. The most inconvenient part? I've to tap in the typing space to be able to see a small little history symbol on the top left. And what happens when I click on it? They have categorised my history into languages, like wow. And I don't need the typing space to cover my whole screen. Who's the product/UX guy who thought this kind of revamp was a good idea? Keep these in beta and AB tests, not the main v",Feature Requests,Features & UI,
12-May-24,Rated 3 stars out of five stars,"Add Feature Can Convert Capital Text into Small Text(English Text). No one Is proving Such type of Services. If any one is providing, then inform me.",Feature Requests,Features & UI,
12-May-24,Rated 5 stars out of five stars,"The best translator available, with good features. Suggestion: function that can translate videos online and offline, pictures on your screen, applications like video calling and offline speak function would be GREAT! The translattion is not perfect on few occasions when offline mode but good enough and I'm satisfied! Please keep up the good work.",Feature Requests,Features & UI,
12-May-24,Rated 2 stars out of five stars,"Used to love it... Can't add to home screen. Requires to open play store, search already installed app from play store and then use the ""open"" button. Super annoying. I used to be able to have the app on my home screen, navigation was one touch and I'm there. Too many steps to enjoy it like before. However, this app displays in your native language how to pronounce the foreign language unlike some others that are similar to this. My rating is low because this is a downgrade from the previous",Feature Requests,Features & UI,
12-May-24,Rated 4 stars out of five stars,[edit] after uninstalling and reinstalling the functionality of [tap to translate] has been restored. however the floating icon stays on the screen permanently whereas before the Android 10 update it one could swipe it away. (Original) Would've been 5 stars before the recent (Android 10) update . ... recent update caused the [Tap to Translate] feature to stop working. ...,Feature Requests,Features & UI,
12-May-24,Rated 1 stars out of five stars,Edit: I already know how to drag the bubble. I want it to appear every time I copy something like the older versions. ____ Please bring switching languages in the Floating Window Translate Menu back. Also it would be so good if the floating icon appears just after when I copy something. The floating icon shouldn't appear always when I turn it on. It should be on screen whenever I copy something. Please bring that feature back too!,Feature Requests,Features & UI,
12-May-24,Rated 4 stars out of five stars,"After I upgraded to android 10, the floating icon is no longer shows up when I highlight a word and it was quite disappointing. But I learnt that I can translate by highlighting the word/s and the option to translate will shows (but I have to copy the words to the writing section). if it not shows on the left side of the ""copy bar"" you might need to press the 3 dots. I learnt it after I reinstalled the app. don't know if that's possible before or without reinstalling it. Hope a better way soon.",Feature Requests,Features & UI,
12-May-24,Rated 2 stars out of five stars,"The ui/ux sucks, always switches keyboard layouts without and it cant configured. There is not clear way to open the translation details.. the ui is so minimalist that you would expect it to somehow naturally gives what you want but it does not. Edit: Also i am surprised that the reverse translation button is hidden in the three dots menu, thats one of the main features i personally use while translating. Probably it should be more prominent, not only when kbrd open",Feature Requests,Features & UI,
12-May-24,Rated 4 stars out of five stars,"I've used this app for years and the floating icon was my favorite feature since 2016 or so. The way it works now is very uncomfortable, I always get distracted while reading because now I have to activate it manually. Not sure why this update was needed. At first I thought something is wrong with my phone and tried to reinstall the app, but turns out it wasn't just a lag? I hope the feature will be back :(",Feature Requests,Features & UI,
12-May-24,Rated 5 stars out of five stars,"Super! Like the new UI! For those who suffer so much: just take one minute and learn the damn interface. It became more convenient to use, the buttons are bigger, the text is larger, synonyms are clickable now and the UI looks nice. Few wishes to the devs: place X button above the language chooser, add Paste button on the plain field (so we don't need to click on the screen to get it) and add the reverse button on the final translation screen so there is no need to go to the drop-down menu.",Feature Requests,Features & UI,
12-May-24,Rated 1 stars out of five stars,"Was 4 stars untill this disaster of a UI update, firstly why are there 3 superfluous buttons taking up the bottom quarter of the screen. This is where tap to enter text should be. Second the handwriting button is moved to the top when it should sit above the keyboard. when I am entering text eg japanese and want to draw in kanji I have to click the top then move back to the bottom to draw. Thirdly there is too little space for results, results should also show pronounciation.",Feature Requests,Features & UI,
12-May-24,Rated 3 stars out of five stars,"The new user interface sucks. It was ugly but practical before. I need a big delete button to quickly delete and write new text. After I send a text I can't switch between languages anymore, I have to go back first. Ana also now the language switch is at the bottom but it is better on the top of the screen to switch quickly. :-(",Feature Requests,Features & UI,
12-May-24,Rated 5 stars out of five stars,"Brilliantly useful. I mainly use the camera feature to translate foreign text, such as paperwork I get at work that has parts in Italian and sometimes French that I have no idea about!! this app solves it! Also, when abroad it's useful to decode menus and signs. It probably has made me more lazy, rather than doing some research before I go abroad as to certain phrases and translations I now just rely on this app.. But that's the future baby!!",Feature Requests,Features & UI,
12-May-24,Rated 3 stars out of five stars,"After recent update the very useful feature ""Tap to Translate"" became very useless. The badge is always showing on screen (why would I want it to?) And if I hide it, it doesn't reappear after copying text to clipboard, though ""Tap to Translate"" is turned on in settings.",Feature Requests,Features & UI,
12-May-24,Rated 1 stars out of five stars,This new update is not good at all I want the older version of this app. It's not user-friendly anymore. In the previous version of this app we had fracture to copy any text and get the translation with even opening the app we still have the feature but now the floating window will always be on screen and that's not good the floating window should only pop up when we copy a text.,Feature Requests,Features & UI,
12-May-24,Rated 2 stars out of five stars,"Hi Google, Can you please add the feature of Screen Translator for Mangas, comics, photos and simple texts on the spot, it will be much easier for us to use this app. Can you please add these features in it. I am refering you the Bubble screen translator also available on play store. But it has purchases for different languages. Please add these features, it will make your app more attractive and more useable for us. Thank you",Feature Requests,Features & UI,
12-May-24,Rated 1 stars out of five stars,"User Interface is bad now for drawing Japanese Kanji. As of this writing, UI in screenshots in store, match an older version that worked great for this. The writing area was stretched to use most of the screen, and you could see suggestions on top. Now app relies on keyboard installed (app uses exact size as drawing area). If you want a bigger area, install a keyboard that can be resized, then resize everytime you need to draw. Gboard by Google can't be resized, so I had to install competition.",Feature Requests,Features & UI,
12-May-24,Rated 2 stars out of five stars,"It was a great app, but after they patched in the new update, the bubble head never goes off the screen. You have to switch off the feature completely for the bubble to go. So inconvenient when having to constantly switching on and off the setting instead of highlighting and a popup appears at the top of the screen.",Feature Requests,Features & UI,
12-May-24,Rated 1 stars out of five stars,"I downgraded my vote due to the tap to translate function is not working anymore in Android 10, I do not care if any other app can watch the clipboard (that was the excuse) it is better than just google: Add a permission for that as denied by default and let the user decides which app can access it, but no let's remove it and do not offer any alternative option. In chrome you can translate from contextual menu after a long press but is located in the last option is not intuitive and more steps.",Feature Requests,Features & UI,
12-May-24,Rated 3 stars out of five stars,"Pretty good and fast translation unlike others asking to register and pay monthly contribution bla bla. Problem to this app, it doesn't look professional by format. I get to see translation letters but not a sheet with the translation. Must say this kind of App should be available to everyone, all over the world. Brings the world easier and together. Would give 5 stars if visually looks better as/in a sheet with possibility of Editing, add words or comment and place picture and signature.",Feature Requests,Features & UI,
12-May-24,Rated 4 stars out of five stars,"It's a very used app for me, I'm using it daily and for hours, translating new words that I hear from a movie its like opening 2 windows and translate during the watch time without quite the movie. But one thing I wish you guys to add and that is to add customizable collection that we can create to get groups of saved words that we want to review it fast to learn it later, without the need to search among hundreds of lines. Add a button next to each word in the favorite list that read the word",Feature Requests,Features & UI,
12-May-24,Rated 1 stars out of five stars,Horrible experiences after the new interface * Extremely hard to use tap to translate feature! Better u should avoid that feature! No use at all * translator works slow and needs extra 3-4 steps to complete a translation! Before it was just copy text it'll be translated! This updation is like modern era to stone age like! Better bring back the older version that we where using last 4 years!,Feature Requests,Features & UI,
12-May-24,Rated 1 stars out of five stars,Edit: I already know how to drag the bubble. I want it to appear every time i copy something like the older versions. ____ Please bring switching languages in the Floating Window Translate Menu back. Also it would be so good if the floating icon appears just after when I copy something. The floating icon shouldn't appear always when I turn it on. It should be on screen whenever I copy something. Please bring that feature back too!,Feature Requests,Features & UI,
12-May-24,Rated 3 stars out of five stars,"Google Translate already has a lot of progress. But it would be even better if you restore the translation icon feature that automatically appears on the screen after copying the text. In my opinion, that's more practical, than having to repeatedly swipe down the notification bar. Please fix it. Thank you.",Feature Requests,Features & UI,
